sample_id,text,source_wav_path,duration
bahraini_sft_conversation_gen_cleaned_000310_response_seg_01,تربطه بسلك من الأول للثاني وتعطل DHCP بالثاني.,,
bahraini_sft_conversation_gen_single_speaker_cleaned_000820_response_seg_01,كلم القسم/التسجيل وخذ رقم المادة والشعبة، وشيّك بعد إذا عندك هولد يمنع ظهور الدرجات.,,
bahraini_sft_conversation_gen_single_speaker_cleaned_000633_response_seg_00,إذا صار تغيير كبير بالراتب أو توقف صرف راتب بنفس الشهر،,,
bahraini_conversation_multiturn_gen_single_speaker_cleaned_000023_assistant_01_seg_00,اي اقدر.,,
bahraini_sft_conversation_gen_cleaned_000612_response_seg_01,عادة نحتاج تقرير من الدكتور يحدد موعد الولادة المتوقع،,,
bahraini_sft_conversation_gen_single_speaker_cleaned_000675_response_seg_01,حاولون تثبتون المسير بدري قدر الإمكان عشان ما يتأخر الدعم.,,
bahraini_conversation_multiturn_gen_single_speaker_cleaned_000347_assistant_01_seg_01,بعضهم معاينة في مركز تقدير،,,
bahraini_sft_conversation_gen_cleaned_000958_response_seg_01,قولي موعدك الحالي وشنو الوقت اللي تبيه بالضبط، وأنا أشيك إذا متوفر مع الفريق.,,
bahraini_conversation_multiturn_gen_single_speaker_cleaned_000225_assistant_05_seg_00,هني السبب غالباً.,,
bahraini_sft_conversation_gen_cleaned_000867_response_seg_01,تراجع شؤون الطلبة ومعاك المستند، وهم يعدلونه رسميا.,,
bahraini_sft_conversation_gen_cleaned_001287_response_seg_00,"اكتب: ""شباب، اللي يحصل مفتاح مكتب (رقم/وصف بسيط) انقلب عليه اليوم في القسم.",,
bahraini_sft_conversation_gen_single_speaker_cleaned_001089_response_seg_01,التأمين يعتمد عليه للموافقة أو للتسوية النقدية.,,
bahraini_sft_conversation_gen_cleaned_000402_response_seg_00,تأكد من وجود ضمان وكرت أصالة، رقم موديل واضح، وجودة المفصلات والنقش.,,
bahraini_sft_conversation_gen_cleaned_000912_response_seg_03,حسابك سكني ولا عندك محل؟,,
bahraini_sft_conversation_gen_cleaned_001272_response_seg_02,ضاع مني مفتاح (وصفه/الميدالية) غالبا في مدخل العمارة اليوم حوالي الساعة (..).,,
bahraini_sft_conversation_gen_single_speaker_cleaned_001188_response_seg_00,اوكي، نقدر نرسلها كملف PDF أو صورة.,,
bahraini_sft_conversation_gen_single_speaker_cleaned_000620_response_seg_02,إذا طولت أكثر من 3-5 أيام عمل، اسأل الشركة إذا محتاجين توضيح محتوى أو مستندات.,,
bahraini_sft_conversation_gen_single_speaker_cleaned_001098_response_seg_01,بعض الوثائق عندها تغطية زجاج بدون تأثير كبير.,,
bahraini_conversation_multiturn_gen_single_speaker_cleaned_000203_assistant_05_seg_01,بس لا تعتمدين عليه بروحه، ارفعي العقد النهائي أول ما يصير جاهز.,,
bahraini_conversation_multiturn_gen_single_speaker_cleaned_000076_assistant_03_seg_00,اوكي، غير كلمة مرور التطبيق إذا تقدر، وفعّل إشعارات كل العمليات.,,
bahraini_sft_conversation_gen_cleaned_001059_response_seg_00,أكيد، أطبع لك تأكيد الإقامة مع التواريخ وبيانات الفندق.,,
bahraini_conversation_multiturn_gen_single_speaker_cleaned_000266_assistant_01_seg_01,الفعلية يعني موظف/نظام قرأ العداد نفس الشهر فالحساب دقيق.,,
bahraini_sft_conversation_gen_cleaned_001000_response_seg_01,عطني تفضيلك: واتساب ولا إيميل؟,,
bahraini_conversation_multiturn_gen_single_speaker_cleaned_000373_assistant_03,السبت الصبح عندنا 10:30 أو 11:30، أي واحد تبي؟,,
bahraini_sft_conversation_gen_single_speaker_cleaned_000395_response_seg_01,إذا فيه عيب مصنعي واضح، نقدر نرفع طلب فحص ونشوف شنو يصير.,,
bahraini_sft_conversation_gen_cleaned_000574_response_seg_03,والراتب الأساسي والإجمالي إذا تبغي.,,
bahraini_sft_conversation_gen_cleaned_000273_response_seg_01,جرب 5GHz أو Wi‑Fi 6 إذا جهازك يدعم، وخلك قريب من الراوتر.,,
bahraini_sft_conversation_gen_cleaned_000786_response_seg_00,ممكن سخان أو مكيف يشتغل بكفاءة ضعيفة، أو استخدام أكثر من المعتاد بسبب الجو.,,
bahraini_sft_conversation_gen_cleaned_001192_response_seg_01,خلي الزيارة أول مرة قصيرة للتعارف والفحص البسيط، وخله ياخذ وقته.,,
bahraini_conversation_multiturn_gen_single_speaker_cleaned_000188_assistant_01_seg_01,مو كل خصم يومي.,,
bahraini_conversation_multiturn_gen_single_speaker_cleaned_000298_assistant_05_seg_01,إذا في test بسيط أو أسئلة تقنية محددة، خبروني قبلها.,,
bahraini_sft_conversation_gen_single_speaker_cleaned_001032_response_seg_01,مرات يوصلون خلال 10-15 دقيقة.,,
bahraini_conversation_multiturn_gen_single_speaker_cleaned_000028_assistant_05_seg_01,عطهم رقم الحساب وقل لهم التغيير تم بس السرعة ما تبدلت حتى بعد فصل كامل.,,
bahraini_sft_conversation_gen_single_speaker_cleaned_000578_response_seg_05,يعتمد شنو سياستكم مع العملاء.,,
bahraini_sft_conversation_gen_single_speaker_cleaned_000443_response_seg_03,بعدين صور المستندات المطلوبة،,,
bahraini_sft_conversation_gen_single_speaker_cleaned_001046_response_seg_00,اسألهم عن عنوان الاستلام وشنو تكتب على الطرد: اسمك + رقم الحجز + تاريخ الوصول.,,
bahraini_sft_conversation_gen_single_speaker_cleaned_000765_response_seg_01,شهر الفاتورة،,,
bahraini_conversation_multiturn_gen_single_speaker_cleaned_000046_assistant_03_seg_00,الصراحة بهالحالة الإرجاع صعب لأن المنتج انفتح وما نقدر نضمن حالته.,,
bahraini_conversation_multiturn_gen_single_speaker_cleaned_000116_assistant_03_seg_00,Label created يعني بس طبعوا ملصق الشحن، مو استلام.,,
bahraini_sft_conversation_gen_cleaned_000792_response_seg_01,وراقب قراءة العداد إذا تتغير.,,
bahraini_sft_conversation_gen_single_speaker_cleaned_000058_response_seg_00,يعتمد إذا نفس المشكلة ونفس الطبيب، بس غالبًا كل طفل له موعد عشان الوقت.,,
bahraini_sft_conversation_gen_cleaned_001275_response_seg_04,وإذا تقدر تتواصل مع البنك من رقم خدمة العملاء وتبلغهم إن البطاقة لقيتها.,,
bahraini_conversation_multiturn_gen_single_speaker_cleaned_000048_assistant_03_seg_02,تقدر تصور فيديو قصير يبين التقطيع؟,,
bahraini_sft_conversation_gen_single_speaker_cleaned_000968_response_seg_01,خلنا نركز على تفاصيل الدور وتوقعاتكم أول،,,
bahraini_conversation_multiturn_gen_single_speaker_cleaned_000007_assistant_01_seg_02,وبعد، تقدر تصوم ٨-١٠ ساعات ولا لا؟,,
bahraini_sft_conversation_gen_cleaned_001300_response_seg_00,ودها لمكتب الأمن/الحارس إذا موجود، أو إدارة الحديقة.,,
bahraini_conversation_multiturn_gen_single_speaker_cleaned_000124_assistant_05_seg_01,إذا مو متوفر بالفرع نقدر نطلبه من فرع ثاني إذا متاح.,,
bahraini_sft_conversation_gen_cleaned_001089_response_seg_01,وإذا خسارة كلية يعوضون وفق بند القيمة في الوثيقة، مو شرط سعر الشراء.,,
bahraini_conversation_multiturn_gen_single_speaker_cleaned_000218_assistant_01_seg_05,وإذا رد غير واضح، قولي “ممكن توضحين لي الخطوة اللي بعدها وكم المدة؟”,,
bahraini_conversation_multiturn_gen_single_speaker_cleaned_000216_assistant_05_seg_00,إذا بس مطابقة دفع، غالباً خلال يومين إلى 5 ايام عمل.,,
bahraini_sft_conversation_gen_single_speaker_cleaned_001121_response_seg_02,وإذا تقولي تاريخ التحويل وآخر 4 أرقام من رقم العضوية أقدر أساعدج أتتبعينها.,,
bahraini_sft_conversation_gen_single_speaker_cleaned_000719_response_seg_00,حسب الخدمة، بس وايد جهات يفضلون PDF واضح ومقروء.,,
bahraini_sft_conversation_gen_cleaned_000461_response_seg_00,اكتب المحافظة/المنطقة، بعدين الشارع، رقم البيت، والمجمع إذا موجود.,,
bahraini_sft_conversation_gen_cleaned_000084_response_seg_02,تبي أعيد الطلب ولا تفضل تعويض؟,,
bahraini_conversation_multiturn_gen_single_speaker_cleaned_000135_assistant_03_seg_01,وشنو اللون اللي تبيه بدل؟,,
bahraini_conversation_multiturn_gen_single_speaker_cleaned_000079_assistant_01_seg_01,من التطبيق ادخلي على بطاقة الولد > إعدادات/Controls > عطّلي Online transactions أو,,
bahraini_sft_conversation_gen_cleaned_000466_response_seg_00,بعض المراكز عندهم أولوية لكبار السن وذوي الإعاقة والحوامل، والعوائل حسب التنظيم.,,
bahraini_conversation_multiturn_gen_single_speaker_cleaned_000103_assistant_01_seg_01,تقدر تعطيني شنو مكتوب في التتبع عن آخر محاولة وتاريخها؟,,
bahraini_sft_conversation_gen_cleaned_000218_response_seg_02,شيك مسمى العملية في كشف البطاقة، وإذا تحب قول لي اسم البطاقة وأقول لك شنو شروطها عادة.,,
bahraini_conversation_multiturn_gen_single_speaker_cleaned_000125_assistant_03_seg_01,إذا انت واقف عند الكاشير لف يسار وامشِ لين تشوف الرفوف الملونة.,,
bahraini_sft_conversation_gen_single_speaker_cleaned_000827_response_seg_00,لازم عذر طبي رسمي بتاريخ يوم الاختبار أو قبله،,,
bahraini_sft_conversation_gen_single_speaker_cleaned_000660_response_seg_01,مهم يتعدل عشان توصلك الإشعارات وما يفوتك شي.,,
bahraini_conversation_multiturn_gen_single_speaker_cleaned_000355_assistant_05_seg_03,وتحتاجون تأكيد رقمين الجوالين.,,
bahraini_sft_conversation_gen_cleaned_000211_response_seg_01,إذا اكتملت العملية يتحول Posted، وإذا ألغيت/ما تمت غالبا يفك الحجز بعد كم يوم.,,
bahraini_conversation_multiturn_gen_single_speaker_cleaned_000017_assistant_01_seg_00,اوكي، نقدر نطلع لك تقرير زيارة إذا كان موجود بالنظام.,,
bahraini_sft_conversation_gen_cleaned_001112_response_seg_02,ولا تشغل السيارة إذا الماي وصل للمكينة.,,
bahraini_sft_conversation_gen_cleaned_000560_response_seg_02,وإذا عندك شي مستعجل قل للشركة ترفع أولوية أو تختار استلام من نقطة.,,
bahraini_sft_conversation_gen_single_speaker_cleaned_001145_response_seg_00,تأكّد إن الشبكة زينة ورسائل الحظر مو مفعّلة، وجربي تعيدين الطلب بعد دقيقة.,,
bahraini_sft_conversation_gen_cleaned_000594_response_seg_00,أفهم عليك، خلنا نراجع قسيمة الراتب: هل في خصم تأخير، غياب، أو استقطاع سلفة/تأمين؟,,
bahraini_sft_conversation_gen_cleaned_000254_response_seg_03,شنو الموديل عشان أعطيك المسار بالضبط؟,,
bahraini_sft_conversation_gen_cleaned_000135_response_seg_01,عطني رقم التتبع أو رقم الطلب، وقل لي الوقت الأنسب لك، وبنسوي لك إعادة جدولة للتسليم.,,
bahraini_sft_conversation_gen_single_speaker_cleaned_001083_response_seg_01,بس إذا في بند يتيح لك اختيار ورشة مع تسوية مختلفة، تقدر تستخدمه.,,
bahraini_sft_conversation_gen_cleaned_000033_response,أكيد، عطيني المنطقة اللي بتطلع منها عشان أوصف لك الطريق بشكل أوضح، وتبي بعد مواقف قريبة؟,,
bahraini_sft_conversation_gen_single_speaker_cleaned_000399_response_seg_01,إذا تقدر تمرّ أيام الأسبوع أحسن من الويكند.,,
bahraini_sft_conversation_gen_cleaned_000146_response_seg_02,وبأشيك لك إذا نقدر نمشيها كاستثناء.,,
bahraini_sft_conversation_gen_single_speaker_cleaned_001193_response_seg_01,أي أسبوع من الحمل الحين عشان ننصح بالوقت الأنسب؟,,
bahraini_conversation_multiturn_gen_single_speaker_cleaned_000410_assistant_03_seg_00,اوكي، قول لهم: ورقتين 50 بمكان محدد بين أي رفوف، عشان لو صاحبها يسأل يعطي وصف صحيح.,,
bahraini_sft_conversation_gen_single_speaker_cleaned_000113_response_seg_01,إذا تقول لي العلامة ونوع القطعة وطول/وزن تقريبي، أساعدك تختار أقرب مقاس.,,
bahraini_sft_conversation_gen_single_speaker_cleaned_000860_response_seg_00,إذا انسحبت بعد فترة الاسترجاع، ممكن ما يرجعون رسومها أو يرجعون جزء.,,
bahraini_sft_conversation_gen_single_speaker_cleaned_000357_response_seg_01,إذا الوقت قصير ما أنصح، لأن بتدخل جوازات وتتفتيش مرة ثانية وانت راجع.,,
bahraini_sft_conversation_gen_single_speaker_cleaned_000522_response_seg_01,وحط العنوان الجديد ورقم التواصل وإيميلك الشخصي إذا مطلوب.,,
bahraini_conversation_multiturn_gen_single_speaker_cleaned_000017_assistant_03_seg_00,تمام، بشيك.,,
bahraini_sft_conversation_gen_single_speaker_cleaned_000256_response_seg_04,"ومع مراعاة عدم تلامس الادوات."" تبين اضيف لج شنو الاطباق اللي عادة يكون فيها خطر؟",,
bahraini_sft_conversation_gen_cleaned_000535_response_seg_01,إذا تعطيني نوع السلعة وسعرها مع الشحن (تقريبا)،,,
bahraini_sft_conversation_gen_single_speaker_cleaned_000120_response_seg_01,عطيني رقم التتبع ورقم تلفون التواصل اللي بالطلب،,,
bahraini_sft_conversation_gen_cleaned_000624_response_seg_00,قريبة منها بس تختلف شوي: خطاب تحويل راتب يوضح إن راتبك ينزل على حسابك في البنك.,,
bahraini_conversation_multiturn_gen_single_speaker_cleaned_000301_assistant_03_seg_00,خلها 6:30 زين.,,
bahraini_sft_conversation_gen_cleaned_001148_response_seg_00,طبيعي وايد ناس نفس الشي.,,
bahraini_sft_conversation_gen_cleaned_000136_response_seg_03,وبنحدد لك خيار تعويض أو إعادة إرسال إذا لازم.,,
bahraini_sft_conversation_gen_single_speaker_cleaned_000889_response_seg_02,وإذا عندك رقم تقريبي لأجهزة كبيرة مثل المكيف والسخان،,,
bahraini_sft_conversation_gen_cleaned_000673_response_seg_02,عندكم موعد ثابت لصرف الراتب ولا يتغير؟,,
bahraini_sft_conversation_gen_cleaned_000284_response_seg_03,كاميراتك كم وحدة وتشتغل على 2.4GHz؟,,
bahraini_sft_conversation_gen_single_speaker_cleaned_000361_response_seg_02,تقدر تتأكد من الشركة قبل لا تروح.,,
bahraini_sft_conversation_gen_cleaned_000328_response_seg_01,تقدر بعد تغليف بالمطار، بس تأكد ما يغطيون مكان بطاقة الشحن.,,
bahraini_sft_conversation_gen_cleaned_000918_response_seg_00,العداد الذكي يفيدك بالمراقبة ويقلل القراءات التقديرية، وتقدر تشوف استهلاكك بشكل أوضح.,,
bahraini_conversation_multiturn_gen_single_speaker_cleaned_000280_assistant_03_seg_01,قدّمي الطلب من نموذج التظلمات في البوابة،,,
bahraini_sft_conversation_gen_cleaned_000824_response_seg_02,من وين محول، وهل المواد كانت بنفس عدد الساعات؟,,
bahraini_sft_conversation_gen_single_speaker_cleaned_000765_response_seg_02,وملاحظة إن الاستهلاك أعلى من المعتاد مع ذكر متوسط استهلاكك بالشهور اللي طافت.,,
bahraini_conversation_multiturn_gen_single_speaker_cleaned_000236_assistant_03_seg_02,واتصل بخدمة العملاء وقل لهم رقم الحساب ورقم العملية عشان يفعلون الخدمة بسرعة،,,
bahraini_sft_conversation_gen_cleaned_000493_response_seg_01,خلك مختصر لأنهم بس يحتاجون سبب عام.,,
bahraini_sft_conversation_gen_single_speaker_cleaned_000358_response_seg_04,بس أول خطوة البلاغ داخل المطار.,,
bahraini_conversation_multiturn_gen_single_speaker_cleaned_000230_assistant_01_seg_01,عندك رقمين خدمة/Service No مختلفين؟,,
bahraini_sft_conversation_gen_cleaned_000451_response_seg_02,عشان ما نضيع وقتك.,,
bahraini_sft_conversation_gen_cleaned_000934_response_seg_01,بس إذا قوي أو معاه حرارة/ريحة أو شرر،,,
bahraini_sft_conversation_gen_cleaned_000848_response_seg_01,الأفضل تبدل شعبة أو تغير مادة.,,
bahraini_sft_conversation_gen_cleaned_000536_response_seg_01,مرات يطلبون تصريح، ومرات لازم إرجاع للمرسل.,,
bahraini_conversation_multiturn_gen_single_speaker_cleaned_000370_assistant_05_seg_01,إذا ما كان نازل، بنفعّله يدوي وبيوصل لك إشعار بالتحديث.,,
bahraini_sft_conversation_gen_single_speaker_cleaned_000498_response_seg_00,عادة تنرفع كإذن خروج/إجازة مرضية حسب السياسة.,,
bahraini_conversation_multiturn_gen_single_speaker_cleaned_000387_assistant_03_seg_00,اوكي، عندنا فتحة 6:45 تعديل حشوة، ما تاخذ وقت.,,
bahraini_sft_conversation_gen_single_speaker_cleaned_001166_response_seg_02,تبين تدورين بالتطبيق ولا تفضّلين أقول لج وين بالضبط حسب الواجهة؟,,
bahraini_sft_conversation_gen_single_speaker_cleaned_000096_response_seg_00,اي إذا عندك حساب، تقدر تختار (إعادة الطلب) من سجل الطلبات إذا متاح.,,
bahraini_sft_conversation_gen_single_speaker_cleaned_000531_response_seg_02,وخله مكتوب عشان ما يصير لبس بعدين.,,
bahraini_sft_conversation_gen_single_speaker_cleaned_001082_response_seg_02,الأفضل تطلع على بند السائق المصرح وتراجع الشركة.,,
bahraini_conversation_multiturn_gen_single_speaker_cleaned_000083_assistant_01_seg_02,تبينها لحالج ولا مع أحد؟,,
bahraini_sft_conversation_gen_cleaned_001168_response_seg_03,وبعدين نحدد لك جلسة أو جلستين حسب الحالة.,,
bahraini_conversation_multiturn_gen_single_speaker_cleaned_000395_assistant_03_seg_00,اوكي كلمه بأدب واذكر وقت الرحلة ومكان الركوب والنزول، وقل له السماعات في علبة بيضا.,,
bahraini_sft_conversation_gen_cleaned_000186_response_seg_00,إذا الموضوع مستعجل، عطني رقم الطلب هني وبشيك لك فورا.,,
bahraini_conversation_multiturn_gen_single_speaker_cleaned_000231_assistant_01_seg_00,غالباً يطلبون إثبات ملكية أو عقد إيجار باسمك،,,
bahraini_sft_conversation_gen_cleaned_000897_response_seg_01,جرب تخليه على درجة متوسطة، وتأكد من العزل.,,
bahraini_sft_conversation_gen_cleaned_000576_response_seg_00,رصيدك يعتمد على استحقاقك الشهري واللي استخدمته قبل.,,
bahraini_conversation_multiturn_gen_single_speaker_cleaned_000157_assistant_01_seg_03,شنو رقم بوابتج؟,,
bahraini_sft_conversation_gen_cleaned_000091_response_seg_00,عادة 35-50 دقيقة حسب الضغط.,,
bahraini_conversation_multiturn_gen_single_speaker_cleaned_000127_assistant_05_seg_01,إذا تبي، قل لي تفضّل شاشة 14 ولا 15.6 عشان الوزن والشنطة.,,
bahraini_conversation_multiturn_gen_single_speaker_cleaned_000148_assistant_01_seg_01,الأفضل قبل الرحلة بـ 48 ساعة عشان يثبتون الطلب.,,
bahraini_sft_conversation_gen_single_speaker_cleaned_000266_response_seg_01,إذا تقول لي منطقتك والمنصة، اقدر اقترح مطاعم اسعارهم مناسبة.,,
bahraini_sft_conversation_gen_single_speaker_cleaned_000074_response_seg_01,شيّكي أول شي إذا الطلب مقسّم على أكثر من شحنة، مرات توصل قطع على دفعات.,,
bahraini_sft_conversation_gen_cleaned_001252_response_seg_00,لا تخاف، إذا سويناها بطريقة صحيحة ما يضيع شي.,,
bahraini_sft_conversation_gen_cleaned_000467_response_seg_01,وإذا عندك مرافق يترجم لك بعد زين.,,
bahraini_sft_conversation_gen_single_speaker_cleaned_000710_response_seg_00,يعني رجعوه لك عشان تعدّلين شي، غالباً مرفق ناقص أو بيانات مو مطابقة.,,
bahraini_conversation_multiturn_gen_single_speaker_cleaned_000241_assistant_05_seg_00,إذا تخاف من غرامة/فصل،,,
bahraini_sft_conversation_gen_single_speaker_cleaned_000038_response_seg_00,عادي، نقدر نبحث بالاسم ورقم الجوال أو الرقم المدني.,,
bahraini_conversation_multiturn_gen_single_speaker_cleaned_000181_assistant_03_seg_00,مرات يبونه توقيع حضوري، ومرات يمشي توقيع إلكتروني حسب النظام.,,
bahraini_sft_conversation_gen_single_speaker_cleaned_000456_response_seg_01,الأفضل تاخذ معاك أكثر من إثبات عشان ما يصير ما ضبط.,,
bahraini_sft_conversation_gen_cleaned_000467_response_seg_00,قول للاستقبال إنك تحتاج مساعدة لغة، بعضهم يوفر موظف يساعد أو يخلونك عند شباك محدد.,,
bahraini_conversation_multiturn_gen_single_speaker_cleaned_000052_assistant_05_seg_01,إذا طلع عالي، نخليها شحنة وحدة بدون تغيير.,,
bahraini_conversation_multiturn_gen_single_speaker_cleaned_000147_assistant_03_seg_01,خذي تقرير حديث،,,
bahraini_conversation_multiturn_gen_single_speaker_cleaned_000233_assistant_05_seg_02,والجهة بعد تقدر تسوي تحويل داخلي إذا الحسابين لك.,,
bahraini_sft_conversation_gen_single_speaker_cleaned_000446_response_seg_02,إذا ما عندك، اكتب “غير متوفر” وخله للموظف يستخرجه من النظام.,,
bahraini_sft_conversation_gen_single_speaker_cleaned_000405_response_seg_02,عندج صورة للتهيج أو تاريخ الشراء؟,,
bahraini_sft_conversation_gen_cleaned_001232_response_seg_00,عادة المستويات تعتمد على فترة تقييم (مثلا سنة) وإذا ما تحقق الشرط ينزل المستوى تلقائي.,,
bahraini_sft_conversation_gen_single_speaker_cleaned_000371_response_seg_01,وإذا القيمة عالية، خفف لفت النظر واحتفظ بفواتيرها احتياط.,,
bahraini_sft_conversation_gen_cleaned_001068_response_seg_00,تقدر تتصل من تلفون الغرفة على خدمة الغرف، أو نرسل لك القائمة على الواتساب إذا تبي.,,
bahraini_sft_conversation_gen_single_speaker_cleaned_000377_response_seg_01,إذا القميص بحالته وما انغسل،,,
bahraini_conversation_multiturn_gen_single_speaker_cleaned_000122_assistant_03_seg_00,زين، شوفي العطور اللي فيها Amber + Vanilla أو Amber + Oud، ثباتها غالبًا عالي.,,
bahraini_sft_conversation_gen_cleaned_000970_response_seg_01,إذا الوظيفة تتطلب إنجليزي بنسأل كم سؤال بالإنجليزي، بس لا تشيل هم.,,
bahraini_conversation_multiturn_gen_single_speaker_cleaned_000185_assistant_01_seg_00,الموضوع يعتمد إذا الدعم ينزل للشركة ولا مباشرة للموظف حسب البرنامج.,,
bahraini_sft_conversation_gen_single_speaker_cleaned_001261_response_seg_00,إذا في احتمال إنها برا البيت، الأفضل توقفينها مؤقت أو تجمدينها من التطبيق إذا متوفر.,,
bahraini_sft_conversation_gen_single_speaker_cleaned_001051_response_seg_01,كلم الريسبشن واطلبهم يرسلونها للغرفة.,,
bahraini_conversation_multiturn_gen_single_speaker_cleaned_000318_assistant_05_seg_00,تمام، بحطها كطلب مؤكد للتبديل باچر إذا ما ضبط اليوم.,,
bahraini_sft_conversation_gen_single_speaker_cleaned_001286_response_seg_01,وخليهم يسجلونها، وصاحبها غالباً بيراجع نفس المكان.,,
bahraini_conversation_multiturn_gen_single_speaker_cleaned_000389_assistant_05_seg_01,إذا عندج حساسية من بنج أو أدوية، خبرينا أول ما توصلين.,,
