sample_id,text,source_wav_path,duration
bahraini_sft_conversation_gen_cleaned_000768_response_seg_03,يساعد وايد لو تحط ستاير ثقيلة وتسكر الفتحات اللي يدخل منها هوا حار.,,
bahraini_sft_conversation_gen_cleaned_000532_response_seg_02,عطيني اسم الشركة وبقول لك خياراتهم.,,
bahraini_sft_conversation_gen_cleaned_000870_response_seg_01,جهز إثباتات دخلك/ظرفك إذا طلبوا.,,
bahraini_sft_conversation_gen_single_speaker_cleaned_000963_response_seg_00,قول: للمقابلة الحضورية، تبون نسخة CV مطبوعة أو يكفي اللي عندكم؟,,
bahraini_sft_conversation_gen_cleaned_000197_response_seg_01,جرب تغير بين واي فاي وبيانات،,,
bahraini_sft_conversation_gen_single_speaker_cleaned_000211_response_seg_00,في التطبيق تحت Credit Card > Statement أو Card details يبين “Payment due date”.,,
bahraini_sft_conversation_gen_single_speaker_cleaned_000670_response_seg_01,الأفضل تسوون تصحيح للوضع وتشيكون إذا فيه ملاحظات في ملف المنشأة عند التقديم.,,
bahraini_sft_conversation_gen_single_speaker_cleaned_000642_response_seg_00,أشهر الأسباب: نقص مستندات، عدم تطابق بيانات الموظفين، أو مشكلة في الآيبان/التحويل.,,
bahraini_sft_conversation_gen_cleaned_000807_response_seg_01,أما الرسوم الثابتة تكون مبلغ شبه ثابت مقابل خدمة معينة.,,
bahraini_sft_conversation_gen_single_speaker_cleaned_000191_response_seg_01,خلك على راوتر واحد رئيسي،,,
bahraini_conversation_multiturn_gen_single_speaker_cleaned_000149_assistant_01_seg_01,إذا تقدر تدخل، تقدر تطلع بس انتبه لوقت الرجعة قبل الرحلة.,,
bahraini_conversation_multiturn_gen_single_speaker_cleaned_000209_assistant_03_seg_01,سو متابعة مكتوبة واطلب “تحديد الملاحظات الفنية إن وجدت” واسم المهندس المسؤول.,,
bahraini_sft_conversation_gen_single_speaker_cleaned_000404_response_seg_02,وإذا تبين شي يومي ولا للسهرة؟,,
bahraini_sft_conversation_gen_cleaned_001240_response_seg_00,تلقاها بقسم “العروض” داخل التطبيق، عادة تنفلتر حسب موقعك.,,
bahraini_conversation_multiturn_gen_single_speaker_cleaned_000175_assistant_01_seg_00,"اكتب الغرض بشكل محدد: ""تسليم مستندات""، ""مراجعة معاملة""، ""استلام بطاقة"".",,
bahraini_sft_conversation_gen_cleaned_000733_response_seg_02,قول لي جهة عملك ونوع وظيفتك، وبقول لك الأقسام المحتملة.,,
bahraini_sft_conversation_gen_cleaned_000375_response,إي عادي، العلك والحلويات الصلبة تمشي بدون مشكلة عادة.,,
bahraini_conversation_multiturn_gen_single_speaker_cleaned_000103_assistant_03_seg_02,حاطين ملاحظة للكوريير.,,
bahraini_sft_conversation_gen_cleaned_000727_response_seg_01,شيك المستندات وتأكد من الIBAN.,,
bahraini_sft_conversation_gen_cleaned_001204_response_seg_02,إذا ما وصل خلال 10 دقايق، قولي وقت الاستبدال وبشيك لك وأعيد إرسال الكوبون.,,
bahraini_conversation_multiturn_gen_single_speaker_cleaned_000081_assistant_03_seg_00,زين، العادي غالباً يوصل نفس اليوم إذا قبل cutoff time، وإذا بعده يوصل باچر يوم عمل.,,
bahraini_sft_conversation_gen_cleaned_000825_response_seg_03,وأنا أقول لك الموعد اللي ينطبق عليك.,,
bahraini_sft_conversation_gen_single_speaker_cleaned_001049_response_seg_02,تبي تمدد ليلة ولا تقلل؟,,
bahraini_sft_conversation_gen_cleaned_000480_response_seg_01,وإذا ما عندك، قول للموظف المنطقة واسم الشارع ويمكن يساعدك تطلعه.,,
bahraini_sft_conversation_gen_single_speaker_cleaned_000194_response_seg_00,تقدر تعيد تعيين الـPIN من الصراف الآلي إذا البنك يدعم هالشي،,,
bahraini_conversation_multiturn_gen_single_speaker_cleaned_000207_assistant_01_seg_01,بس شنو رقم الطلب، وشنو تاريخ التقديم، وشنو الوظيفة/الجهة؟,,
bahraini_sft_conversation_gen_cleaned_000804_response_seg_00,إذا البيت فيه لمبات وايد ومشغلة ساعات طويلة، LED تفرق مع الوقت.,,
bahraini_sft_conversation_gen_single_speaker_cleaned_000516_response_seg_07,تبينها رسالة داخلية ولا إيميل للجهة الأعلى؟,,
bahraini_sft_conversation_gen_single_speaker_cleaned_000770_response_seg_00,تقدر تلغيها من إعدادات التنبيهات في حسابك إذا كانت مفعّلة،,,
bahraini_sft_conversation_gen_cleaned_000764_response_seg_03,إذا قعد يتحرك فالتسريب قبل المحبس؛,,
bahraini_sft_conversation_gen_cleaned_000836_response_seg_02,هل وصلك إشعار بسبب؟,,
bahraini_sft_conversation_gen_cleaned_000666_response_seg_02,التحويل.,,
bahraini_conversation_multiturn_gen_single_speaker_cleaned_000105_assistant_01_seg_02,شنو نوع الشحن؟,,
bahraini_conversation_multiturn_gen_single_speaker_cleaned_000267_assistant_01_seg_00,مو شرط ينزل إذا الاستخدام زاد أو البيت حر أكثر.,,
bahraini_sft_conversation_gen_cleaned_001055_response_seg_00,مضبوط، بخلي طلبك كأولوية إذا صار نفس السعر أو ترقية مجانية.,,
bahraini_sft_conversation_gen_single_speaker_cleaned_001229_response_seg_01,شنو الخدمات المطلوبة لكل واحد فيهم عشان نحدد مدة كل موعد؟,,
bahraini_sft_conversation_gen_cleaned_000064_response_seg_01,عندك حساسية من شي مثل الجلوتين أو الألبان؟,,
bahraini_sft_conversation_gen_cleaned_001314_response_seg_02,وإذا ما في جهة، خلها بمكان واضح وآمن قريب من وين لقيتها لفترة قصيرة.,,
bahraini_sft_conversation_gen_cleaned_000384_response_seg_01,وإذا يقبلون دفع ذاتي أو تاتش، يكون أسرع بعد.,,
bahraini_conversation_multiturn_gen_single_speaker_cleaned_000356_assistant_03_seg_02,وبقول لج مستواج الحالي وشنو باقي لج عشان ترتقين.,,
bahraini_sft_conversation_gen_cleaned_000705_response_seg_00,لازم ترفع طلب تصحيح بيانات أو تعديل إفادة من نفس الخدمة،,,
bahraini_conversation_multiturn_gen_single_speaker_cleaned_000236_assistant_01_seg_02,الدفع صار متى وبأي طريقة؟,,
bahraini_sft_conversation_gen_cleaned_001117_response_seg_00,تحديد المسؤولية عادة يعتمد على تقرير الحادث والرسمة والأقوال وأحيانا صور الكاميرات.,,
bahraini_sft_conversation_gen_cleaned_001236_response_seg_00,إذا ما تم استخدام الكوبون/المكافأة، غالبا نقدر نلغي ونرجع النقاط.,,
bahraini_sft_conversation_gen_cleaned_000148_response_seg_00,تقدر من صفحة الطلب أو من رسالة التتبع اللي تنرسل لك.,,
bahraini_conversation_multiturn_gen_single_speaker_cleaned_000326_assistant_03_seg_00,تمام، بنضيفه على الحجز وقد يكون في رسوم إضافية تشمل الإفطار إذا باكيجكم فيه.,,
bahraini_sft_conversation_gen_cleaned_000002_response_seg_00,أكيد، عطيني رقم ملفك أو رقم الهوية عشان أطلع حجزك.,,
bahraini_sft_conversation_gen_cleaned_000420_response_seg_03,جهازك آيفون ولا أندرويد؟,,
bahraini_sft_conversation_gen_cleaned_001299_response_seg_02,إذا ما ضبط، اطلب اسم المسؤول وخط الموضوع رسميا.,,
bahraini_sft_conversation_gen_single_speaker_cleaned_001181_response_seg_00,إذا عندك رقم البطاقة،,,
bahraini_sft_conversation_gen_cleaned_000883_response_seg_02,تقدر تقارن قراءة العداد بين هالشهر واللي طاف عشان تتأكد الزيادة من الاستهلاك ولا من قراءة.,,
bahraini_conversation_multiturn_gen_single_speaker_cleaned_000196_assistant_03_seg_01,واذا عندك صفحات وايد، شيل الصفحات اللي ما لها علاقة بالمتطلب وخلي المهم بس.,,
bahraini_sft_conversation_gen_cleaned_001088_response_seg_01,ويخصمون أحيانا التحمل وأي مستحقات.,,
bahraini_conversation_multiturn_gen_single_speaker_cleaned_000063_assistant_01_seg_02,أو فحص امتثال،,,
bahraini_conversation_multiturn_gen_single_speaker_cleaned_000055_assistant_03_seg_00,تمام، أشوف إن الشاحن متأخر من المستودع وبيطلع بشحنة ثانية.,,
bahraini_conversation_multiturn_gen_single_speaker_cleaned_000355_assistant_03_seg_02,إذا كان مختلف، نقدر نعمل ربط يدوي ونضيف النقاط.,,
bahraini_conversation_multiturn_gen_single_speaker_cleaned_000260_assistant_05_seg_03,إذا يظل يتحرك بشكل واضح يعني تسريب مستمر.,,
bahraini_sft_conversation_gen_cleaned_000246_response_seg_02,أو البنك المستفيد رفضه بسبب اسم غير مطابق.,,
bahraini_sft_conversation_gen_single_speaker_cleaned_000170_response_seg_00,لا تستخدم WEP لأنه ضعيف وايد.,,
bahraini_conversation_multiturn_gen_single_speaker_cleaned_000001_assistant_03_seg_00,اوكي، السبت الصبح عندنا ٩:٣٠ أو ١١:٠٠ عند دكتورة الأسنان.,,
bahraini_sft_conversation_gen_single_speaker_cleaned_001088_response_seg_00,تابع برقم المطالبة واسم الموظف اللي ماسك الملف، وخله كله مكتوب (إيميل/رسائل رسمية).,,
bahraini_sft_conversation_gen_single_speaker_cleaned_000116_response_seg_00,اوكي نعدله إذا الطلب للحين ما انشحن، وإذا انشحن نبلغ شركة الشحن بالتحديث.,,
bahraini_sft_conversation_gen_cleaned_001191_response_seg_02,تبي نفس الأسبوع ولا عادي الأسبوع الياي؟,,
bahraini_sft_conversation_gen_cleaned_001184_response_seg_00,أكيد لازم نشوفه بسرعة.,,
bahraini_sft_conversation_gen_cleaned_001058_response_seg_01,قول لي الوقت والوجهة وعدد الأشخاص.,,
bahraini_conversation_multiturn_gen_single_speaker_cleaned_000324_assistant_03_seg_00,اوكي، تبغي تمديد لحد 2؟,,
bahraini_sft_conversation_gen_cleaned_000135_response_seg_00,عادي تصير.,,
bahraini_conversation_multiturn_gen_single_speaker_cleaned_000081_assistant_05_seg_00,عادة موجود بمعلومات التحويل داخل التطبيق أو صفحة الرسوم والحدود.,,
bahraini_conversation_multiturn_gen_single_speaker_cleaned_000091_assistant_05_seg_01,لا تنحط مع الساندويتش نفس الكيس.,,
bahraini_sft_conversation_gen_cleaned_000884_response_seg_03,عندك رقم الحساب أو رقم العداد عشان أقول لك شلون تراجعها بسرعة؟,,
bahraini_conversation_multiturn_gen_single_speaker_cleaned_000350_assistant_03_seg_00,ممكن يطلبون تفويض أو حضور المالك للتوقيع على بعض النماذج، خصوصاً إذا بيصير تعويض نقدي.,,
bahraini_sft_conversation_gen_single_speaker_cleaned_000208_response_seg_00,تروح للمدفوعات/Payments،,,
bahraini_conversation_multiturn_gen_single_speaker_cleaned_000084_assistant_05_seg_01,واطلب تصعيد للـ support supervisor أو تعويض كرصيد.,,
bahraini_sft_conversation_gen_cleaned_001240_response_seg_02,قولي منطقتك أو الفرع اللي تروح له أكثر شي،,,
bahraini_sft_conversation_gen_cleaned_000912_response_seg_00,التعرفة تعتمد على نوع الاستخدام (سكني/تجاري) وأحيانا على فئات استهلاك.,,
bahraini_conversation_multiturn_gen_single_speaker_cleaned_000007_assistant_05_seg_00,تم حجز سحب الدم ٨:٠٠.,,
bahraini_sft_conversation_gen_cleaned_000098_response_seg_00,إذا الطلب بعده ما انحسب نهائيا نقدر نعدله، بس إذا انخصم وانقفل ممكن ما يضبط.,,
bahraini_sft_conversation_gen_cleaned_001092_response_seg_01,بتحتاج ترفع صور المستندات وصور الضرر، وبعدها يتواصلون وياك للتقييم أو موعد معاينة.,,
bahraini_sft_conversation_gen_single_speaker_cleaned_001070_response_seg_02,إذا ما موجود، ممكن تكون على حسابك.,,
bahraini_sft_conversation_gen_cleaned_000773_response_seg_00,18 تخلي المكيف يشتغل أقصى طاقته أكثر وقت، وهذا يرفع الفاتورة وايد.,,
bahraini_conversation_multiturn_gen_single_speaker_cleaned_000082_assistant_05_seg_00,الرايتا (لبن وخيار) وايد تضبط وتخفف الحرارة.,,
bahraini_sft_conversation_gen_cleaned_000243_response_seg_02,تقدر تقول لي شنو اللي ما صار يمشي معاك بالضبط؟,,
bahraini_sft_conversation_gen_single_speaker_cleaned_000913_response_seg_01,إذا أكثر من 30-31 بشكل واضح، هذا يفسر الزيادة.,,
bahraini_sft_conversation_gen_single_speaker_cleaned_000229_response_seg_01,شيك إشعارات التطبيق إذا يطلب تحديث الهوية،,,
bahraini_sft_conversation_gen_cleaned_000458_response_seg_01,قول لي شنو الخدمة وأقول لك إذا لها موعد ولا تمشي برقم مباشر.,,
bahraini_sft_conversation_gen_cleaned_000867_response_seg_00,يصير، بس لازم يكون مطابق للجواز/الهوية.,,
bahraini_sft_conversation_gen_single_speaker_cleaned_000960_response,قول: ممكن تعطوني رقم مباشر أو ext عشان إذا صار أي تأخير بسيط يوم المقابلة أتواصل بسرعة؟,,
bahraini_sft_conversation_gen_cleaned_000982_response_seg_00,أكيد سلامتك.,,
bahraini_sft_conversation_gen_cleaned_000125_response_seg_01,عطني رقم الطلب والمقاس اللي وصلك والمقاس اللي تبيه،,,
bahraini_sft_conversation_gen_cleaned_000715_response_seg_01,«السلام عليكم،,,
bahraini_conversation_multiturn_gen_single_speaker_cleaned_000188_assistant_03_seg_01,وخلي بيانات التأمينات متطابقة.,,
bahraini_sft_conversation_gen_single_speaker_cleaned_000711_response_seg_01,"بعد شوف إذا فيه فرع ثاني قريب، أو خيار ""قائمة انتظار"" إذا موجود.",,
bahraini_sft_conversation_gen_cleaned_000822_response_seg_00,عادة يكون في البوابة الإلكترونية تحت “خطابات/شهادات” أو تقدر تطلبه من شؤون الطلبة.,,
bahraini_sft_conversation_gen_single_speaker_cleaned_001002_response_seg_02,تبيها باسم شخص معين على كل فاتورة ولا نفس الاسم؟,,
bahraini_sft_conversation_gen_cleaned_000359_response_seg_00,نظفها وجففها زين، وحط العطور داخل كيس محكم ولفها بتيشيرتات.,,
bahraini_sft_conversation_gen_cleaned_000862_response_seg_01,قول لي كم مادة ناوي تاخذ، وشنو وضعك من ناحية دوام/التزامات؟,,
bahraini_sft_conversation_gen_single_speaker_cleaned_000077_response_seg_03,وبعد ما توصلنا/تتأكد الحالة يبدأ رد المبلغ لنفس طريقة الدفع.,,
bahraini_conversation_multiturn_gen_single_speaker_cleaned_000264_assistant_01_seg_01,هل هالارتفاع يطابق أيام غسيل/نشافة أو تنظيف مكيفات؟,,
bahraini_sft_conversation_gen_cleaned_000398_response_seg_01,وجربها على جوالك إذا يسمحون، وتأكد من العزل والمايك.,,
bahraini_sft_conversation_gen_cleaned_000197_response_seg_02,وتشيك إذا في تحديث للتطبيق،,,
bahraini_sft_conversation_gen_cleaned_000103_response_seg_01,عندك حساسية من اللاكتوز ولا من كل مشتقات الحليب؟,,
bahraini_sft_conversation_gen_single_speaker_cleaned_000183_response_seg_01,جرّب مكان قريب من الشباك، وخلي الشبكة 5G Auto، وسوي Speedtest بأوقات مختلفة.,,
bahraini_conversation_multiturn_gen_single_speaker_cleaned_000294_assistant_03_seg_01,بتكون حضوري ولا أونلاين؟,,
bahraini_conversation_multiturn_gen_single_speaker_cleaned_000223_assistant_05_seg_01,الأهم يبين الختم والرقم بوضوح.,,
bahraini_conversation_multiturn_gen_single_speaker_cleaned_000031_assistant_03_seg_00,طلعّه لمكان مفتوح وتهوية زينة، وخله بعيد عن الأجهزة اللي تسخن.,,
bahraini_conversation_multiturn_gen_single_speaker_cleaned_000236_assistant_03_seg_02,واتصل بخدمة العملاء وقل لهم رقم الحساب ورقم العملية عشان يفعلون الخدمة بسرعة،,,
bahraini_sft_conversation_gen_cleaned_001048_response_seg_00,أكيد نخزنها لك بأمان لين تجهز الغرفة.,,
bahraini_sft_conversation_gen_single_speaker_cleaned_001259_response_seg_01,وخذها مباشرة لأقرب مركز شرطة أو أمن المكان وسلمها.,,
bahraini_sft_conversation_gen_single_speaker_cleaned_000447_response_seg_00,اكتبه بالإنجليزي مثل جوازك بالضبط عشان ما يصير اختلاف.,,
bahraini_conversation_multiturn_gen_single_speaker_cleaned_000229_assistant_05_seg_00,على واجهة العداد نفسه مكتوب Meter No،,,
bahraini_conversation_multiturn_gen_single_speaker_cleaned_000350_assistant_05_seg_01,إذا عندك شرط وكالة/إصلاح بالوكالة لازم تلتزم فيه،,,
bahraini_sft_conversation_gen_single_speaker_cleaned_000967_response_seg_00,شكراً لكم على تنسيق موعد المقابلة.,,
bahraini_sft_conversation_gen_single_speaker_cleaned_000900_response_seg_01,إذا على المشترك، عادة تنحسب على المالك/الجمعية حسب النظام.,,
bahraini_sft_conversation_gen_single_speaker_cleaned_000743_response_seg_01,وإذا احتجت تواصل،,,
bahraini_sft_conversation_gen_cleaned_000405_response_seg_01,خذ شاحن معتمد ويفضل من نفس البراند أو موزع رسمي.,,
bahraini_sft_conversation_gen_cleaned_000779_response_seg_02,وإذا فيها تصنيف كفاءة طاقة (A أو أقل) يفرق وايد.,,
bahraini_sft_conversation_gen_cleaned_000025_response_seg_00,على حسب الدور والزحمة، بس إذا فيه فراغ بنحاول نقدمك.,,
bahraini_conversation_multiturn_gen_single_speaker_cleaned_000193_assistant_03_seg_01,وتأكدوا حساب البنك صحيح ومفعل.,,
bahraini_sft_conversation_gen_cleaned_000810_response_seg_00,إذا تستخدمون فرن كهربائي أو عين كهربا، أكيد تزيد.,,
bahraini_conversation_multiturn_gen_single_speaker_cleaned_000215_assistant_05_seg_02,نرجو إفادتنا بتحديث الحالة وأي مستندات مطلوبة لإكمال الإجراء.,,
bahraini_sft_conversation_gen_cleaned_000464_response_seg_00,بعض النماذج التوقيع يكون آخر صفحة تحت الإقرار، أو يمين تحت.,,
bahraini_sft_conversation_gen_single_speaker_cleaned_000310_response_seg_01,إذا كله مضبوط،,,
bahraini_conversation_multiturn_gen_single_speaker_cleaned_000368_assistant_05_seg_01,إذا تشوف إن ما انحسبت حتى على المنتجات، عطِني رقم الفاتورة وبنضيفها يدوي إذا صار خلل.,,
bahraini_sft_conversation_gen_cleaned_000612_response_seg_01,عادة نحتاج تقرير من الدكتور يحدد موعد الولادة المتوقع،,,
bahraini_conversation_multiturn_gen_single_speaker_cleaned_000072_assistant_03_seg_02,دور على خيار Settlement/إغلاق مبكر لأنه يحسب لحد تاريخ اليوم ويمكن يختلف عن الرصيد العادي.,,
bahraini_sft_conversation_gen_single_speaker_cleaned_000804_response_seg_01,وخلي الغسيل والتنشيف على دفعات ممتلئة.,,
bahraini_sft_conversation_gen_cleaned_001162_response_seg_00,إي نقدر نسوي الأشعة داخل العيادة حسب النوع المطلوب.,,
bahraini_sft_conversation_gen_cleaned_000173_response_seg_02,إذا التأخير مننا أو من شركة التوصيل نقدر نشوف لك تعويض مناسب.,,
bahraini_conversation_multiturn_gen_single_speaker_cleaned_000172_assistant_03_seg_00,اسأل إذا يقدرون يحفظون رقم دورك أو يعطونك رقم تذكرة ترد عليه، لأن مرات ما يقدرون.,,
bahraini_conversation_multiturn_gen_single_speaker_cleaned_000071_assistant_01_seg_00,سكرها فوراً من التطبيق:,,
bahraini_sft_conversation_gen_cleaned_000115_response_seg_00,غالبا ما في فرق، بس بعض السلطات عليها إضافة بسيطة.,,
bahraini_sft_conversation_gen_cleaned_000011_response_seg_02,وعنده أعراض ثانية مثل كحة قوية أو خمول؟,,
bahraini_sft_conversation_gen_cleaned_000914_response_seg_02,تقدر تطلب من المؤجر يوضح لك قراءة العداد والفاتورة الأصلية.,,
bahraini_sft_conversation_gen_cleaned_000636_response_seg_01,وإذا عندك حساب مرتبط تقدر تشوف وضعك كمستفيد.,,
bahraini_sft_conversation_gen_single_speaker_cleaned_000533_response_seg_00,وثّق التواريخ والمواقف والكلام قدر الإمكان،,,
bahraini_sft_conversation_gen_single_speaker_cleaned_000194_response_seg_01,أو من التطبيق عبر Card settings.,,
bahraini_sft_conversation_gen_single_speaker_cleaned_000661_response_seg_01,بس كثير من برامج الدعم تربطها بتسجيل الموظف بالتأمينات وصرف راتب فعلي.,,
bahraini_sft_conversation_gen_cleaned_000685_response_seg_01,كتابة الرقم بروحها ممكن فيها غلط رقم واحد ويوقف الصرف.,,
bahraini_sft_conversation_gen_single_speaker_cleaned_000570_response_seg_03,تاريخ الإرسال،,,
bahraini_sft_conversation_gen_cleaned_000719_response_seg_00,شوف تسلسل الحالة:,,
bahraini_conversation_multiturn_gen_single_speaker_cleaned_000219_assistant_05_seg_00,مرات يبين بس إذا الحالة “مرفوض/مطلوب استكمال”.,,
bahraini_sft_conversation_gen_cleaned_000919_response_seg_01,إي ينخفض استهلاكك،,,
bahraini_conversation_multiturn_gen_single_speaker_cleaned_000229_assistant_01_seg_01,إذا عقبها صاروا ياخذون قراءة فعلية، ممكن يطلع فرق ويبين كزيادة مرة وحدة.,,
bahraini_sft_conversation_gen_cleaned_000574_response_seg_04,البنك طلبها بالعربي ولا بالإنجليزي؟,,
bahraini_sft_conversation_gen_cleaned_000119_response_seg_00,إي، نقدر نحدد وقت باچر.,,
bahraini_conversation_multiturn_gen_single_speaker_cleaned_000070_assistant_05_seg_00,بعض التطبيقات تسمح Custom date range تحت التقارير/Transactions وتطلعها PDF أو Excel.,,
bahraini_conversation_multiturn_gen_single_speaker_cleaned_000257_assistant_03_seg_02,عادة المكيف والسخان والنشافة هم أكبر ثلاث.,,
bahraini_conversation_multiturn_gen_single_speaker_cleaned_000074_assistant_03_seg_01,إذا ما ضبطت الإضافة، جرّبي من داخل تطبيق البنك خيار Add to Wallet إذا موجود.,,
bahraini_conversation_multiturn_gen_single_speaker_cleaned_000401_assistant_01_seg_01,شنو لونها، عمرها، هل عليها طوق/شريحة، وآخر مرة انشافت وين؟,,
bahraini_sft_conversation_gen_cleaned_000649_response_seg_00,ممكن يأثر لأن التطابق مهم خاصة بالآيبان والتحويل.,,
bahraini_sft_conversation_gen_cleaned_000159_response_seg_00,بعض التخفيضات عليها شروط خاصة.,,
bahraini_sft_conversation_gen_cleaned_001215_response_seg_00,خلنا نراجع شروط العرض:,,
bahraini_sft_conversation_gen_cleaned_000479_response_seg_00,إذا بتطلع دقايق احتمال ينادون رقمك، فالأفضل تنتظر لين يقرب دورك بعدين تروح بسرعة.,,
bahraini_conversation_multiturn_gen_single_speaker_cleaned_000371_assistant_05_seg_00,زين، أقدر أثبت لك الاثنين الساعة 5:30 العصر للتنظيف.,,
bahraini_sft_conversation_gen_cleaned_000670_response_seg_01,اللي يأخر غالبا نقص مستند أو عدم تطابق بيانات.,,
bahraini_sft_conversation_gen_single_speaker_cleaned_000537_response_seg_00,اذكر الفترة المطلوبة وسبب عام بدون دخول بتفاصيل خاصة،,,
bahraini_sft_conversation_gen_cleaned_000518_response_seg_01,عطيني رقم التتبع واسم الشركة، وبنفس الوقت اسأل الحارس/الاستقبال إذا عندكم.,,
