sample_id,text,source_wav_path,duration
bahraini_conversation_multiturn_gen_single_speaker_cleaned_000063_assistant_01_seg_01,التحويل الدولي مرات يتأخر بسبب بنوك وسيطة،,,
bahraini_sft_conversation_gen_cleaned_000739_response_seg_03,أي جهة عندكم؟,,
bahraini_sft_conversation_gen_cleaned_000172_response_seg_00,نفس المبدأ، بس التنفيذ أحيانا يكون عن طريق البائع.,,
bahraini_sft_conversation_gen_cleaned_001203_response_seg_00,غالبا يا أما ما وصلت الحد الأدنى للاستبدال أو في تحديث/صيانة بالنظام.,,
bahraini_sft_conversation_gen_single_speaker_cleaned_000900_response_seg_00,يعتمد إذا المضخة على عداد الخدمات المشتركة ولا على عداد شقتك.,,
bahraini_conversation_multiturn_gen_single_speaker_cleaned_000194_assistant_05_seg_01,لأن تمكين تتشدد بهالجزئية لحماية بيانات الشركة.,,
bahraini_conversation_multiturn_gen_single_speaker_cleaned_000053_assistant_05_seg_01,أو إذا تحب الخصوصية،,,
bahraini_sft_conversation_gen_cleaned_000478_response_seg_00,عادة بطاقتك، وبيانات الشخص (الاسم الكامل، تاريخ الميلاد، رقم شخصي إذا تعرفه).,,
bahraini_sft_conversation_gen_single_speaker_cleaned_000194_response_seg_00,تقدر تعيد تعيين الـPIN من الصراف الآلي إذا البنك يدعم هالشي،,,
bahraini_sft_conversation_gen_cleaned_000560_response_seg_00,ممكن يتأخر شوي إذا صار ازدحام أو توقف مؤقت للسلامة.,,
bahraini_sft_conversation_gen_cleaned_000799_response_seg_01,إذا تقدر استخدمه دفعات أقل، أو استخدم القلاية الهوائية للأشياء الصغيرة، بتلاحظ فرق.,,
bahraini_sft_conversation_gen_single_speaker_cleaned_000517_response_seg_05,عطني اسم مديرك وبسويها ألطف.,,
bahraini_sft_conversation_gen_single_speaker_cleaned_000774_response_seg_00,تقدر تراجع صفحة التعرفة بحسابك أو تسأل خدمة العملاء عن شريحة التعرفة لحسابك،,,
bahraini_conversation_multiturn_gen_single_speaker_cleaned_000075_assistant_01_seg_01,من تاجر.,,
bahraini_conversation_multiturn_gen_single_speaker_cleaned_000286_assistant_03_seg_02,وبيطلع لك تاريخ ووقت وقاعة كل مادة.,,
bahraini_conversation_multiturn_gen_single_speaker_cleaned_000391_assistant_03_seg_01,تبين نسوي صور وسكان بنفس الموعد؟,,
bahraini_sft_conversation_gen_single_speaker_cleaned_000944_response_seg_01,HR بس ولا مع المدير المباشر بعد؟,,
bahraini_conversation_multiturn_gen_single_speaker_cleaned_000394_assistant_05_seg_00,حط إعلان عام بدون صورة واضحة للمفتاح ولا الميدالية،,,
bahraini_sft_conversation_gen_cleaned_001331_response_seg_00,اطلب منهم يشوفون سجل الطلبات والقطع اللي طلعت بنفس اليوم،,,
bahraini_conversation_multiturn_gen_single_speaker_cleaned_000116_assistant_03_seg_03,احتمال الشحنة للحين عنده وما مشى شي.,,
bahraini_sft_conversation_gen_cleaned_000861_response_seg_01,انت منحة من وين؟,,
bahraini_sft_conversation_gen_cleaned_001310_response_seg_00,لا تخليها عندك.,,
bahraini_conversation_multiturn_gen_single_speaker_cleaned_000285_assistant_01_seg_01,هل باقي طلبتك في نفس المادة نزلت لهم الدرجات ولا نفس الشي؟,,
bahraini_sft_conversation_gen_single_speaker_cleaned_000916_response_seg_01,وإذا الزيادة غير منطقية، قدّم اعتراض بنفس الوقت عشان ما تتحملها بدون مراجعة.,,
bahraini_sft_conversation_gen_single_speaker_cleaned_001146_response_seg_00,بعض الفواتير لازم تنضاف خلال مدة معينة أو من فروع محددة.,,
bahraini_sft_conversation_gen_single_speaker_cleaned_000843_response_seg_01,شيّك من الشؤون المالية إذا عندك رقم طلب أو إذا حسابك البنكي محدث.,,
bahraini_sft_conversation_gen_cleaned_000460_response_seg_00,إذا بس سؤال دقيقتين، الاستقبال يكفي غالبا.,,
bahraini_sft_conversation_gen_cleaned_001231_response_seg_00,تقدر تشوفها بصفحة “المستويات”، بتطلع لك النقاط/الإنفاق المتبقي.,,
bahraini_sft_conversation_gen_cleaned_000140_response_seg_02,لأن بعض الأكواد ما تمشي على التخفيضات أو على فئات معينة.,,
bahraini_sft_conversation_gen_cleaned_000420_response_seg_03,جهازك آيفون ولا أندرويد؟,,
bahraini_conversation_multiturn_gen_single_speaker_cleaned_000396_assistant_01_seg_02,أو تتصل على رقم خدمة العملاء المكتوب وبلغهم عن البطاقة.,,
bahraini_conversation_multiturn_gen_single_speaker_cleaned_000276_assistant_05_seg_01,بتحصلين خيار Swap/Change Section،,,
bahraini_sft_conversation_gen_cleaned_001267_response_seg_00,جرب أول شي تطبيق Find My إذا شغال عندك، يعطيك آخر موقع.,,
bahraini_sft_conversation_gen_cleaned_000216_response_seg_00,من التطبيق اختار “تحويل داخلي” وحدد من أي حساب لأي حساب، وحط المبلغ وتأكيد.,,
bahraini_conversation_multiturn_gen_single_speaker_cleaned_000077_assistant_03_seg_00,زين، إذا جهة العمل ترسل متأخر، البنك ما يقدر ينزله إلا عقب ما يستلم التحويل.,,
bahraini_conversation_multiturn_gen_single_speaker_cleaned_000196_assistant_05_seg_01,وإذا استمر ما يشتغل،,,
bahraini_sft_conversation_gen_single_speaker_cleaned_001013_response_seg_01,قول لهم شنو يهمك: مساحة أكبر، view، lounge access.,,
bahraini_sft_conversation_gen_cleaned_000687_response_seg_00,إذا أنت مسجل بالتأمينات وعقدك شغال رسمي، غالبا ينطبق، لأن فترة التجربة تعتبر توظيف.,,
bahraini_sft_conversation_gen_cleaned_000979_response_seg_00,سلامتك، ولا تشيل هم.,,
bahraini_conversation_multiturn_gen_single_speaker_cleaned_000355_assistant_05_seg_00,اوكي، النقاط تنضاف للحساب اللي باسمه الطلب.,,
bahraini_conversation_multiturn_gen_single_speaker_cleaned_000159_assistant_01_seg_01,بعض الشركات إذا ما سويت اونلاين يحطون رسوم أو يخلوك على آخر المقاعد.,,
bahraini_conversation_multiturn_gen_single_speaker_cleaned_000034_assistant_05_seg_01,بس إذا عندك خدمات رقابة أبوية من المزود، ممكن تتأثر لأنها تعتمد على DNS.,,
bahraini_sft_conversation_gen_single_speaker_cleaned_000170_response_seg_00,لا تستخدم WEP لأنه ضعيف وايد.,,
bahraini_sft_conversation_gen_cleaned_001329_response_seg_02,لا تتأخر لأن وقت الإغلاق قريب.,,
bahraini_sft_conversation_gen_cleaned_000504_response_seg_00,يعني السائق حاول يسلم بس ما تم التسليم لسبب مثل ما رد أحد، أو صعوبة عنوان/بوابة.,,
bahraini_sft_conversation_gen_single_speaker_cleaned_000116_response_seg_00,اوكي نعدله إذا الطلب للحين ما انشحن، وإذا انشحن نبلغ شركة الشحن بالتحديث.,,
bahraini_sft_conversation_gen_cleaned_000165_response_seg_01,عطني رقم الطلب وشنو المشكلة بالضبط (ما يشتغل/يطفى/ما يشحن)،,,
bahraini_sft_conversation_gen_single_speaker_cleaned_000951_response_seg_02,وخليها بجملة: عشان أحسب وقت الوصول.,,
bahraini_sft_conversation_gen_single_speaker_cleaned_001086_response_seg_02,الشفافية هني تحميك.,,
bahraini_conversation_multiturn_gen_single_speaker_cleaned_000324_assistant_05,تمام، بخلي طلب late check-out لحد 2، وبنأكد لك يومها الصبح حسب الإشغال.,,
bahraini_sft_conversation_gen_cleaned_000128_response_seg_00,إي يصير إذا ما تم الشحن.,,
bahraini_sft_conversation_gen_cleaned_000812_response_seg_01,شيك إذا السخان قاعد يسخن طول الوقت، وجرب تخفف الحرارة أو تركب مؤقت.,,
bahraini_conversation_multiturn_gen_single_speaker_cleaned_000089_assistant_05_seg_00,الأفضل ترفعها على التطبيق لأن عندهم سجل، بس بعد تقدر تكلم المطعم إذا رقمهم موجود.,,
bahraini_sft_conversation_gen_cleaned_000754_response_seg_01,وتحط مستند يثبت الموعد إذا موجود.,,
bahraini_sft_conversation_gen_cleaned_000722_response_seg_01,خصوصا في الموسم اللي تزيد فيه طلبات التوظيف.,,
bahraini_sft_conversation_gen_single_speaker_cleaned_000208_response_seg_00,تروح للمدفوعات/Payments،,,
bahraini_conversation_multiturn_gen_single_speaker_cleaned_000055_assistant_01_seg_00,اوكي يمكن الطلب انقسم شحنات، أو في قطعة انعدمت بالمخزن.,,
bahraini_sft_conversation_gen_cleaned_001235_response_seg_01,عطني رقم الفاتورة وبشيك لك إذا انربطت العملية صح.,,
bahraini_sft_conversation_gen_single_speaker_cleaned_001263_response_seg_01,"""السلام عليكم،",,
bahraini_conversation_multiturn_gen_single_speaker_cleaned_000005_assistant_01_seg_01,شنو المشكلة تقريباً: حبوب/حساسية/تساقط شعر/تصبغات؟,,
bahraini_sft_conversation_gen_cleaned_000088_response_seg_00,يصير، بس الأفضل ندمجهم بطلب واحد عشان التوصيل.,,
bahraini_sft_conversation_gen_cleaned_001037_response_seg_01,عطني نوع الحجز أو رقم الغرفة إذا تشكنت.,,
bahraini_conversation_multiturn_gen_single_speaker_cleaned_000202_assistant_05_seg_00,وإذا تبون تتأكدون 100%،,,
bahraini_sft_conversation_gen_cleaned_000769_response_seg_02,وإذا تقدر قول لي هل الفاتورة كهربا بس ولا كهربا وماي؟,,
bahraini_sft_conversation_gen_cleaned_000921_response_seg_02,الأفضل تسأل الجهة المختصة بالخدمات أو الدعم الاجتماعي ويعطونك الشروط.,,
bahraini_conversation_multiturn_gen_single_speaker_cleaned_000125_assistant_01_seg_01,بأي مجمع انت الحين؟,,
bahraini_sft_conversation_gen_single_speaker_cleaned_000911_response_seg_02,إذا كان يصرف حتى وهو مو شغال، غالباً في مشكلة بصمام.,,
bahraini_sft_conversation_gen_single_speaker_cleaned_000229_response_seg_01,شيك إشعارات التطبيق إذا يطلب تحديث الهوية،,,
bahraini_sft_conversation_gen_cleaned_000336_response_seg_00,غالبا يكفي، بس أنا أنصحك تطبع نسخة احتياط لأن مرات يطلبونها عند الكاونتر أو الوصول.,,
bahraini_sft_conversation_gen_cleaned_000772_response_seg_01,إذا الفترة أطول من المعتاد، طبيعي تطلع أعلى حتى لو نفس الاستهلاك اليومي.,,
bahraini_sft_conversation_gen_single_speaker_cleaned_000956_response_seg_01,معاكم فلان.,,
bahraini_sft_conversation_gen_cleaned_001235_response_seg_00,تنحسب إذا حسابك مرتبط بالعملية أو حطيت رقم العضوية قبل الدفع، Apple Pay مثل البطاقة.,,
bahraini_sft_conversation_gen_single_speaker_cleaned_001126_response_seg_00,جربي “نسيت كلمة المرور” وبيوصلك كود على رقم التلفون أو الإيميل المسجل.,,
bahraini_sft_conversation_gen_cleaned_000481_response_seg_00,بعض الجهات تفرق بين الأصل والنسخة، فالأزرق يبين إنه توقيع أصلي.,,
bahraini_sft_conversation_gen_cleaned_000417_response_seg_03,تبغي تحجز شنو بالضبط؟,,
bahraini_sft_conversation_gen_single_speaker_cleaned_000714_response_seg_00,يعتمد على الوزارة،,,
bahraini_sft_conversation_gen_cleaned_000583_response_seg_00,خلني أتأكد لك من رقم بطاقتك/الهوية واسم شركة التأمين.,,
bahraini_conversation_multiturn_gen_single_speaker_cleaned_000084_assistant_03_seg_01,“وصلت الوجبة باردة وغير صالحة للأكل،,,
bahraini_conversation_multiturn_gen_single_speaker_cleaned_000089_assistant_01_seg_01,“طلب رقم كذا،,,
bahraini_sft_conversation_gen_single_speaker_cleaned_001282_response_seg_01,خلك قريب لين يوصلون أهله، وخل التواصل عبر المايك/الإعلانات الرسمية بالمجمع.,,
bahraini_sft_conversation_gen_single_speaker_cleaned_000077_response_seg_03,وبعد ما توصلنا/تتأكد الحالة يبدأ رد المبلغ لنفس طريقة الدفع.,,
bahraini_sft_conversation_gen_single_speaker_cleaned_000849_response_seg_01,تحصل الرقم في جدول المقررات جنب اسم المادة والسكشن.,,
bahraini_sft_conversation_gen_single_speaker_cleaned_000967_response_seg_02,أتطلع للقائكم، وإذا في أي متطلبات قبل الموعد بلغوني.,,
bahraini_sft_conversation_gen_cleaned_001167_response_seg_00,يعتمد على الحالة وخطة العلاج، بس غالبا المتابعة تكون كل 4-6 أسابيع.,,
bahraini_sft_conversation_gen_cleaned_000093_response_seg_01,تبي مايونيز عادي ولا ثوم؟,,
bahraini_sft_conversation_gen_single_speaker_cleaned_000183_response_seg_01,جرّب مكان قريب من الشباك، وخلي الشبكة 5G Auto، وسوي Speedtest بأوقات مختلفة.,,
bahraini_conversation_multiturn_gen_single_speaker_cleaned_000296_assistant_01_seg_00,هلا، حاضر.,,
bahraini_sft_conversation_gen_cleaned_000742_response_seg_01,بعدين تابع مع الجهة اللي كان يشتغل فيها وقسم المالية.,,
bahraini_conversation_multiturn_gen_single_speaker_cleaned_000183_assistant_05_seg_03,خلوا مستنداته جاهزة: عقد، كشف راتب/عرض، وبيانات البنك.,,
bahraini_conversation_multiturn_gen_single_speaker_cleaned_000388_assistant_01_seg_00,تمام، تنظيف الجير يحتاج تقريباً 45-60 دقيقة حسب الحالة.,,
bahraini_sft_conversation_gen_cleaned_000902_response_seg_02,إذا تقولي نوع البيت والمنطقة تقريبا، أوصف لك الأماكن الشائعة هني.,,
bahraini_sft_conversation_gen_cleaned_000060_response_seg_00,إذا التقارير عربي أو إنجليزي عادة تمشي.,,
bahraini_sft_conversation_gen_single_speaker_cleaned_000447_response_seg_00,اكتبه بالإنجليزي مثل جوازك بالضبط عشان ما يصير اختلاف.,,
bahraini_sft_conversation_gen_cleaned_000225_response_seg_01,جرب الدفع بملامسة/شريحة بدل المغناطيس، وتشيك إذا في عمليات Pending.,,
bahraini_conversation_multiturn_gen_single_speaker_cleaned_000356_assistant_01_seg_01,عندنا عادة 3 مستويات: أساسي، فضي، ذهبي، وكل مستوى له نسبة كسب نقاط ومزايا.,,
bahraini_conversation_multiturn_gen_single_speaker_cleaned_000258_assistant_03_seg_01,المتأخرات يعني في مبلغ من شهر طاف ما اندفع كامل.,,
bahraini_sft_conversation_gen_single_speaker_cleaned_000898_response_seg_02,إذا مو واضح، اعطني اسم البند اللي مكتوب وأنا أشرح لك شنو غالباً يقصدون.,,
bahraini_sft_conversation_gen_single_speaker_cleaned_000749_response_seg_02,إذا تقدر، صوّر قراءة العداد الحين وقارنها بقراءة الفاتورة.,,
bahraini_sft_conversation_gen_cleaned_000390_response_seg_01,بعدين طول الأكمام والبنطلون.,,
bahraini_sft_conversation_gen_cleaned_000776_response_seg_00,إذا الخزان فيه عوامة خربانة، بيقعد يعبي وما يوقف وذي ترفع الماي وايد.,,
bahraini_sft_conversation_gen_single_speaker_cleaned_001139_response_seg_01,قولي كم نقطة عندك وشنو نوع بطاقة الهدية اللي تبيها.,,
bahraini_sft_conversation_gen_cleaned_000238_response_seg_05,تبي أشرح لك شلون تفعل التحقق بخطوتين؟,,
bahraini_sft_conversation_gen_cleaned_000320_response_seg_01,بس يعتمد على حجم المطار وهل تحتاج تعيد تفتيش أو تغير ترمنل.,,
bahraini_conversation_multiturn_gen_single_speaker_cleaned_000317_assistant_05_seg_01,وقت الإفطار من 6:30 إلى 10:30 في المطعم بالدور الأرضي.,,
bahraini_sft_conversation_gen_cleaned_000461_response_seg_01,وإذا عندك صندوق بريد اكتبه، بس لا تحط معلومات ناقصة عشان لا يرجعونك.,,
bahraini_sft_conversation_gen_single_speaker_cleaned_000310_response_seg_01,إذا كله مضبوط،,,
bahraini_sft_conversation_gen_single_speaker_cleaned_001099_response_seg_04,حاول توثق مكان الانفجار والضرر.,,
bahraini_conversation_multiturn_gen_single_speaker_cleaned_000152_assistant_03_seg_01,وحطهم بشنطة اليد مو بالشنطة المسجلة.,,
bahraini_conversation_multiturn_gen_single_speaker_cleaned_000070_assistant_05_seg_00,بعض التطبيقات تسمح Custom date range تحت التقارير/Transactions وتطلعها PDF أو Excel.,,
bahraini_sft_conversation_gen_single_speaker_cleaned_000808_response_seg_01,إذا ما عندك صورة، خذ صورة الحين وخذ صورة عقب يومين وشوف هل الفاتورة منطقية مع الاستهلاك.,,
bahraini_conversation_multiturn_gen_single_speaker_cleaned_000144_assistant_03_seg_01,حاول تقعد قريب من باب النزول وتتحرك مباشرة.,,
bahraini_sft_conversation_gen_cleaned_001325_response_seg_00,راجعي أمن المول والاستعلامات بسرعة لأن أغراض الأطفال عادة يرجعون يدورون عليها فورا.,,
bahraini_sft_conversation_gen_single_speaker_cleaned_000981_response_seg_01,وإذا في أي تغيير ثاني خبروني.,,
bahraini_sft_conversation_gen_cleaned_000377_response_seg_03,وإذا عندك فاتورة أو رقم طلب يساعد وايد.,,
bahraini_sft_conversation_gen_cleaned_001299_response_seg_00,كلمهم بهدوء واذكر تاريخ دخول السيارة ومكانها بالورشة،,,
bahraini_sft_conversation_gen_cleaned_000398_response_seg_02,تبيها للمكالمات ولا للموسيقى؟,,
bahraini_sft_conversation_gen_cleaned_000912_response_seg_00,التعرفة تعتمد على نوع الاستخدام (سكني/تجاري) وأحيانا على فئات استهلاك.,,
bahraini_sft_conversation_gen_cleaned_000612_response_seg_03,تبين تبدأين قبل الولادة بفترة ولا بعد؟,,
bahraini_sft_conversation_gen_single_speaker_cleaned_000534_response_seg_00,خله خطاب/إيميل يذكر التاريخ والوقت ومكان المهمة والجهة اللي تمت زيارتها، واعتماد المدير.,,
bahraini_sft_conversation_gen_single_speaker_cleaned_000194_response_seg_01,أو من التطبيق عبر Card settings.,,
bahraini_sft_conversation_gen_single_speaker_cleaned_000663_response_seg_01,بعد جرب تدمج الصفحات في ملف واحد بدل عدة ملفات إذا النظام يسمح.,,
bahraini_conversation_multiturn_gen_single_speaker_cleaned_000263_assistant_03_seg_00,إذا طول الوقت ومع عدم استخدام، هذا احتمال قوي في تسريب يخلي العداد يتحرك.,,
bahraini_sft_conversation_gen_single_speaker_cleaned_000570_response_seg_08,إذا تبي، عطيني نموذج أعمدة عندكم وبضبطه لك بشكل مرتب.,,
bahraini_sft_conversation_gen_cleaned_000539_response_seg_02,قولي منو المتجر وكم لك طالب.,,
bahraini_conversation_multiturn_gen_single_speaker_cleaned_000141_assistant_01_seg_00,هلا فيك.,,
bahraini_sft_conversation_gen_cleaned_000916_response_seg_01,حله عادة تركيب مانع طرق (water hammer) أو تخفيف الضغط إذا عندكم مضخة.,,
bahraini_conversation_multiturn_gen_single_speaker_cleaned_000229_assistant_05_seg_00,على واجهة العداد نفسه مكتوب Meter No،,,
bahraini_sft_conversation_gen_cleaned_000171_response_seg_00,يعتمد على طريقة الدفع الأصلية وسياسة الاسترجاع.,,
bahraini_sft_conversation_gen_cleaned_001006_response_seg_01,ويفضل توصل قبلها بعشر دقايق.,,
bahraini_sft_conversation_gen_cleaned_000813_response_seg_01,خله فجر أو ليل، وتأكد الرشاشات ما ترش برا التربة، وشيك ما فيه لي يسرب.,,
bahraini_conversation_multiturn_gen_single_speaker_cleaned_000170_assistant_01_seg_01,إذا الفاتورة مو باسمك، عقد الإيجار يساعد يثبت علاقتك بالمكان.,,
bahraini_conversation_multiturn_gen_single_speaker_cleaned_000217_assistant_03_seg_02,ارفع طلب دعم وارفق شهادة الفحص،,,
bahraini_sft_conversation_gen_cleaned_000679_response_seg_01,إذا طال أكثر من المعتاد، غالبا في ملاحظة تحتاج رد.,,
bahraini_sft_conversation_gen_cleaned_000646_response_seg_01,إذا في شي ناقص بيرسلون لك طلب استكمال.,,
bahraini_conversation_multiturn_gen_single_speaker_cleaned_000200_assistant_01_seg_00,اذا الطلب بعده Under review، مرات يخلون تعديل بيانات أساسية، ومرات لازم تلغي وتعيد.,,
bahraini_sft_conversation_gen_cleaned_000014_response_seg_01,قولي إذا الألم وايد ومعاه انتفاخ أو حرارة؟,,
bahraini_conversation_multiturn_gen_single_speaker_cleaned_000071_assistant_05_seg_02,بتطلع لك الرسوم قبل التأكيد أو تقدر تتأكد من جدول الرسوم داخل التطبيق.,,
bahraini_conversation_multiturn_gen_single_speaker_cleaned_000357_assistant_01_seg_00,افهمك، بس النظام يحط صلاحية عشان الحسابات تظل نشطة.,,
bahraini_sft_conversation_gen_cleaned_000667_response_seg_02,لازم تشيك شلون مسجل عند التأمينات.,,
bahraini_sft_conversation_gen_single_speaker_cleaned_000538_response_seg_01,اكتبي الفرع الحالي والفرع المطلوب،,,
bahraini_sft_conversation_gen_cleaned_001307_response_seg_01,إذا تقدر، اكتب بلاغ رسمي عند الشرطة لأن اللابتوب غالي وفيه بيانات.,,
bahraini_sft_conversation_gen_cleaned_000349_response_seg_02,أهم شي تكون واضح وهادئ عشان يمشونها لك بسلاسة.,,
bahraini_sft_conversation_gen_single_speaker_cleaned_000041_response_seg_01,قولي لي التخصص وأي يوم يناسبج عشان أطلع لج الخيارات.,,
bahraini_conversation_multiturn_gen_single_speaker_cleaned_000028_assistant_03_seg_01,طفّه من الكهرباء 5 دقايق عشان session تنقطع بالكامل.,,
bahraini_conversation_multiturn_gen_single_speaker_cleaned_000348_assistant_03_seg_01,وبتحتاجين تتابعين قانونياً/مرورياً لتحصيل حقج من الطرف الثاني.,,
bahraini_sft_conversation_gen_cleaned_000450_response_seg_01,وإذا ما في، اطلب من الموظف دقايق وبيعطونك.,,
bahraini_conversation_multiturn_gen_single_speaker_cleaned_000386_assistant_01_seg_01,تفضلون موعد بعد المدرسة ولا في الويكند؟,,
bahraini_sft_conversation_gen_single_speaker_cleaned_000899_response_seg_01,إذا في استهلاك غير طبيعي، قدّم بلاغ رسمي عشان يكون في مرجع.,,
bahraini_sft_conversation_gen_cleaned_001082_response_seg_00,ينفع، بس الصور تساعد وايد بالتقييم.,,
bahraini_sft_conversation_gen_cleaned_001099_response_seg_00,ممكن، بس يعتمد على نوع الخدمة وهل كانت طارئة ولا اختيارية.,,
bahraini_sft_conversation_gen_single_speaker_cleaned_000356_response_seg_01,الأفضل تروح للـ gate فوراً بدون تأخير.,,
bahraini_conversation_multiturn_gen_single_speaker_cleaned_000061_assistant_01_seg_00,ممكن تكون من حد الشراء اليومي، أو البطاقة مقفلة مؤقت، أو مشكلة بالـPIN/الشريحة.,,
bahraini_sft_conversation_gen_cleaned_001092_response_seg_01,بتحتاج ترفع صور المستندات وصور الضرر، وبعدها يتواصلون وياك للتقييم أو موعد معاينة.,,
bahraini_sft_conversation_gen_cleaned_000505_response_seg_06,المجمع السكني/اسم البناية،,,
bahraini_sft_conversation_gen_cleaned_000389_response_seg_00,لازم تشوف الستكر على القطعة أو لوحة الشروط داخل المحل،,,
bahraini_sft_conversation_gen_cleaned_000670_response_seg_02,أنت قدمت من متى؟,,
bahraini_sft_conversation_gen_cleaned_000938_response_seg_01,أو القاطع حق الدائرة ضعيف.,,
bahraini_sft_conversation_gen_cleaned_000012_response_seg_01,أي تخصص تبي وشنو الوقت اللي تقدر تمر؟,,
