sample_id,text,source_wav_path,duration
bahraini_sft_conversation_gen_cleaned_000797_response_seg_01,شيك قراءة العداد اليومين الجايين وإنت مطفي أكثر الأجهزة،,,
bahraini_sft_conversation_gen_cleaned_000571_response_seg_01,قول لي تبيها بطاقة دخول بس ولا مع صلاحية مواقف بعد؟,,
bahraini_sft_conversation_gen_cleaned_000497_response_seg_01,وإذا ما تعرف ترجمة المنطقة، اكتبها بالعربي وخله الموظف يساعدك يثبتها في النظام.,,
bahraini_sft_conversation_gen_single_speaker_cleaned_000467_response_seg_00,قول: “لو سمحت، رقمي …,,
bahraini_sft_conversation_gen_cleaned_000189_response_seg_00,ممكن يكون الموقع حاط حماية إضافية أو عندك حد للشراء أونلاين.,,
bahraini_sft_conversation_gen_cleaned_001130_response_seg_04,قدمها خلال المدة المحددة في الوثيقة.,,
bahraini_sft_conversation_gen_single_speaker_cleaned_000450_response_seg_00,غالبًا يكون ضمن نموذج تحديث البيانات أو “تعديل بيانات الاتصال”.,,
bahraini_sft_conversation_gen_cleaned_000219_response_seg_01,أول مرة لازم تضيفها كمفوترة، بعدين تصير أسهل.,,
bahraini_sft_conversation_gen_single_speaker_cleaned_000629_response_seg_01,كشف رواتب أو بيان التأمينات،,,
bahraini_sft_conversation_gen_cleaned_000512_response_seg_03,عشان نعرف سبب الإرجاع بالضبط.,,
bahraini_conversation_multiturn_gen_single_speaker_cleaned_000050_assistant_05_seg_01,وإذا ما وصل خلال دقايق، قولي لي وبنتأكد من الرقم المسجل بالنظام.,,
bahraini_sft_conversation_gen_cleaned_000626_response_seg_00,أرسل صورة من الجواز اليديد والقديم إذا موجود، وبنحدث الرقم وتاريخ الانتهاء.,,
bahraini_sft_conversation_gen_cleaned_001293_response_seg_02,تواصل مع الدعم أو كاونتر التذاكر واذكر الاسم ورقم الطلب.,,
bahraini_sft_conversation_gen_single_speaker_cleaned_000921_response_seg_03,نوع القراءة (Actual/Estimated)،,,
bahraini_conversation_multiturn_gen_single_speaker_cleaned_000094_assistant_05_seg_00,أشياء بسيطة وواضحة المكونات: مشاوي بدون تتبيلة مجهولة، رز أبيض، خضار مشوية.,,
bahraini_sft_conversation_gen_cleaned_000140_response_seg_02,لأن بعض الأكواد ما تمشي على التخفيضات أو على فئات معينة.,,
bahraini_sft_conversation_gen_cleaned_000663_response_seg_00,عادة المسمى بروحه ما يأثر مثل الراتب وتواريخ التسجيل،,,
bahraini_conversation_multiturn_gen_single_speaker_cleaned_000194_assistant_01_seg_00,غالباً الصلاحية مربوطة بالمخول/المدير في السجل أو لازم تفويض داخل بوابة تمكين.,,
bahraini_conversation_multiturn_gen_single_speaker_cleaned_000222_assistant_05_seg_00,ما عليه، من البوابة شوفي سجل الإشعارات أو “الرسائل”.,,
bahraini_sft_conversation_gen_single_speaker_cleaned_000223_response_seg_00,في التطبيق تحت تفاصيل الحساب Account details يطلع IBAN، وتقدر تنسخه.,,
bahraini_conversation_multiturn_gen_single_speaker_cleaned_000381_assistant_05_seg_01,قبل الموعد بس لا تستخدم غسول قوي عشان نقدر نقيم الوضع عدل.,,
bahraini_sft_conversation_gen_cleaned_000677_response_seg_02,إذا تقدر تحصل رقم الطلب من الموارد البشرية بيكون أسرع.,,
bahraini_sft_conversation_gen_cleaned_000349_response_seg_00,تقدر تبلغ موظف التفتيش من البداية،,,
bahraini_conversation_multiturn_gen_single_speaker_cleaned_000159_assistant_05_seg_00,ما يحتاج طابعة عادة، خلي الـ QR على الموبايل.,,
bahraini_sft_conversation_gen_cleaned_000311_response_seg_03,شنو الأجهزة اللي تصير عليها المشكلة؟,,
bahraini_sft_conversation_gen_cleaned_000855_response_seg_01,بعدين يحطونك على قائمة حسب الأحقية.,,
bahraini_sft_conversation_gen_single_speaker_cleaned_000625_response_seg_02,إذا عندك رقم القطع، أساعدك تتابعها.,,
bahraini_sft_conversation_gen_single_speaker_cleaned_000758_response_seg_00,أكثر سببين:,,
bahraini_conversation_multiturn_gen_single_speaker_cleaned_000233_assistant_03_seg_00,اوكي، طلّع كشف مختصر أو إيصال التحويل يبين رقم المرجع ورقم الحساب المدفوع له.,,
bahraini_conversation_multiturn_gen_single_speaker_cleaned_000194_assistant_03_seg_00,إذا عندكم تفويض سابق موثق، استخدميه وارفعيه ضمن طلب الصلاحيات.,,
bahraini_sft_conversation_gen_cleaned_000960_response_seg_02,وإذا ما ضبط اليوم، نعطيك أقرب موعد.,,
bahraini_sft_conversation_gen_single_speaker_cleaned_000834_response_seg_00,ينزل عادة من التسجيل أو البوابة تحت Exam Schedule.,,
bahraini_sft_conversation_gen_cleaned_000056_response_seg_01,تبي موعد اليوم ولا خلال هالأسبوع؟,,
bahraini_sft_conversation_gen_single_speaker_cleaned_001022_response_seg_00,اذا الحجز direct مع الفندق، تقدر تسأل عن price match.,,
bahraini_sft_conversation_gen_cleaned_000447_response_seg_01,بس بعض الطلبات تطلب صورة إذا فيه تحديث بيانات.,,
bahraini_sft_conversation_gen_single_speaker_cleaned_001092_response_seg_02,إذا تبي، قول لي قيمة التحمل تقريبًا وحجم الضرر.,,
bahraini_conversation_multiturn_gen_single_speaker_cleaned_000278_assistant_05_seg_01,شيك وضعك الدراسي في شؤون الطلبة، وإذا مسجل وكل شي تمام، IT يفعّلونه خلال يوم عمل.,,
bahraini_conversation_multiturn_gen_single_speaker_cleaned_000387_assistant_05_seg_01,وإذا الألم زاد قبل الموعد خففي المضغ على هالجهة.,,
bahraini_sft_conversation_gen_cleaned_001276_response_seg_02,وإذا تذكر آخر مكان كنت فيه، اسألهم عن المفقودات يمكن تكون هناك.,,
bahraini_sft_conversation_gen_cleaned_000617_response_seg_01,ارسل لي المستند اللي فيه التاريخ الصحيح، وبنرفع طلب تعديل للأنظمة.,,
bahraini_conversation_multiturn_gen_single_speaker_cleaned_000198_assistant_01_seg_00,رتّبه كـPDF واحد فيه فهرس بسيط:,,
bahraini_sft_conversation_gen_single_speaker_cleaned_001208_response_seg_01,تقدر توصف الحساسية: مع البارد بس ولا حتى بدون سبب؟,,
bahraini_conversation_multiturn_gen_single_speaker_cleaned_000204_assistant_01_seg_00,زين، هالشي يصير مرات إذا الطلب ناقص مستند أو بعده عند قسم المراجعة.,,
bahraini_sft_conversation_gen_cleaned_000736_response_seg_02,شنوع البدل اللي تنتظره؟,,
bahraini_sft_conversation_gen_cleaned_001064_response_seg_00,سهل، قبل آخر يوم بلغنا ونشيك التوفر ونثبت لك بنفس الغرفة إذا نقدر.,,
bahraini_conversation_multiturn_gen_single_speaker_cleaned_000265_assistant_03_seg_00,زين، قدّم طلب جدولة وادفع دفعة أولى بسيطة إذا تقدر عشان يبين حسن نية.,,
bahraini_sft_conversation_gen_cleaned_000028_response_seg_01,قول لي أي تخصص تبي، وبشيك لك الخيارات بعد 7.,,
bahraini_conversation_multiturn_gen_single_speaker_cleaned_000023_assistant_03_seg_01,من Wi‑Fi Settings غيري كلمة المرور وخليها قوية، عقبها لازم تعيدين شبك كل الأجهزة.,,
bahraini_sft_conversation_gen_single_speaker_cleaned_000395_response_seg_01,إذا فيه عيب مصنعي واضح، نقدر نرفع طلب فحص ونشوف شنو يصير.,,
bahraini_sft_conversation_gen_single_speaker_cleaned_001290_response_seg_00,سلمه للشرطة أو لأمن العمارة إذا تعرف وين، ولا تعطيه لأي شخص يدعي.,,
bahraini_conversation_multiturn_gen_single_speaker_cleaned_000128_assistant_01_seg_00,اوكي، إذا عندك الفاتورة أو العملية مسجلة على رقم التلفون/الإيميل نقدر نمشي الإجراء.,,
bahraini_sft_conversation_gen_single_speaker_cleaned_000787_response_seg_02,إذا تبي، أعطيج صيغة بسيطة لبند بالإيجار.,,
bahraini_sft_conversation_gen_cleaned_000413_response_seg_03,وهل عندهم ضمان واضح وموظفين يعرفون المنتج.,,
bahraini_sft_conversation_gen_cleaned_000795_response_seg_00,اوكي: 1) خل المكيف 24–26 ونظف الفلاتر كل شهر.,,
bahraini_conversation_multiturn_gen_single_speaker_cleaned_000298_assistant_03_seg_01,شنو يناسبكم؟,,
bahraini_conversation_multiturn_gen_single_speaker_cleaned_000299_assistant_01_seg_00,هلا، صح.,,
bahraini_conversation_multiturn_gen_single_speaker_cleaned_000031_assistant_01_seg_02,داخل دولاب أو قريب من شباك الشمس؟,,
bahraini_sft_conversation_gen_single_speaker_cleaned_000578_response_seg_01,بس بالنهاية يبين له بيانات مشابهة.,,
bahraini_sft_conversation_gen_single_speaker_cleaned_000443_response_seg_03,بعدين صور المستندات المطلوبة،,,
bahraini_conversation_multiturn_gen_single_speaker_cleaned_000330_assistant_05_seg_01,شنو نوع وثيقتك: شامل ولا ضد الغير؟,,
bahraini_sft_conversation_gen_cleaned_000997_response_seg_01,إذا تقدر توصل خلال 5 دقايق بنحاول ندخلك، وإذا ما ضبط بنحولها لأقرب وقت اليوم أو بكرة.,,
bahraini_sft_conversation_gen_single_speaker_cleaned_001218_response_seg_00,ممكن نسوي استشارة أونلاين إذا الموضوع تقييم أولي أو متابعة بسيطة.,,
bahraini_conversation_multiturn_gen_single_speaker_cleaned_000293_assistant_05,اوكي، ارسلوا الرابط والإيميل حق التأكيد، وبكون جاهز قبلها بدقايق.,,
bahraini_sft_conversation_gen_single_speaker_cleaned_000619_response_seg_00,تقريباً: الطول × العرض × الارتفاع بالسنتيمتر ÷ معامل الشركة (مثل 5000 أو 6000).,,
bahraini_sft_conversation_gen_single_speaker_cleaned_000058_response_seg_00,يعتمد إذا نفس المشكلة ونفس الطبيب، بس غالبًا كل طفل له موعد عشان الوقت.,,
bahraini_conversation_multiturn_gen_single_speaker_cleaned_000410_assistant_01_seg_00,سلمها لخدمة العملاء/الكاشير وخليهم يسجلون المبلغ ووقت ومكان اللقطة.,,
bahraini_sft_conversation_gen_cleaned_001019_response_seg_01,قول لي شنو الوقت اللي تبيه، واذا فيه رسوم إضافية بنبلغك قبل ما نثبت الطلب.,,
bahraini_sft_conversation_gen_single_speaker_cleaned_000640_response_seg_01,حدّث الاسم في البوابة وارفق مستند التغيير إذا طلبوه.,,
bahraini_sft_conversation_gen_cleaned_001166_response_seg_02,عندج حساسية من قبل بالبارد؟,,
bahraini_sft_conversation_gen_single_speaker_cleaned_000131_response_seg_00,هذا يعتمد على باقتك لأن بعض الباقات تكون Download أعلى من Upload.,,
bahraini_conversation_multiturn_gen_single_speaker_cleaned_000241_assistant_01_seg_06,الاعتراض شنو سببه عندك؟,,
bahraini_sft_conversation_gen_cleaned_000343_response_seg_03,روح لمكتب الشركة واسألهم شنو اللي ينطبق على تذكرتك.,,
bahraini_conversation_multiturn_gen_single_speaker_cleaned_000218_assistant_01_seg_04,وشنو تبين بالضبط (تحديث/سبب تأخير/استكمال).,,
bahraini_sft_conversation_gen_cleaned_001288_response_seg_01,سلمها لأمن المجمع أو أقرب مركز شرطة، لأن الهوية وثيقة رسمية.,,
bahraini_sft_conversation_gen_single_speaker_cleaned_000656_response_seg_00,اي مرات يطلبون كشف حساب أو إثبات آيبان عشان يتأكدون من حساب التحويل.,,
bahraini_sft_conversation_gen_cleaned_000187_response_seg_01,قولي منطقتك وخيار التوصيل اللي اخترته، وبأعطيك توقع أقرب للواقع.,,
bahraini_sft_conversation_gen_cleaned_001197_response_seg_01,عطني هالمعلومات ورقم جوالك المسجل، وبنضيفها لك إذا كانت ضمن المدة المسموح فيها.,,
bahraini_conversation_multiturn_gen_single_speaker_cleaned_000203_assistant_03_seg_01,قدمي بالعقد المتوفر عندج مثل offer letter موقّع مؤقتاً،,,
bahraini_sft_conversation_gen_cleaned_000549_response_seg_01,بطلع لك حالة كل شحنة وأي وحدة تحتاج متابعة.,,
bahraini_sft_conversation_gen_single_speaker_cleaned_000718_response_seg_02,تأكد من رقمك وبريدك،,,
bahraini_conversation_multiturn_gen_single_speaker_cleaned_000225_assistant_01_seg_00,اوكي، “تم الإرسال” يعني يا انها انرسلت على ايميلك أو جاهزة للتحميل.,,
bahraini_conversation_multiturn_gen_single_speaker_cleaned_000294_assistant_01_seg_01,شنو الأوقات اللي تناسبكم حق المقابلة الثانية؟,,
bahraini_sft_conversation_gen_cleaned_001252_response_seg_01,بس لازم تحقق عشان نتأكد أنت صاحب الحساب.,,
bahraini_sft_conversation_gen_cleaned_000968_response_seg_00,إي إذا في تعارض قوي نرتب بديل.,,
bahraini_conversation_multiturn_gen_single_speaker_cleaned_000128_assistant_03_seg_00,زين الفاتورة تكفي عادة.,,
bahraini_sft_conversation_gen_cleaned_000926_response_seg_00,مفهوم قلقك.,,
bahraini_sft_conversation_gen_cleaned_000542_response_seg_01,بعد، اكتب تسلسل المشكلة وتواريخها.,,
bahraini_conversation_multiturn_gen_single_speaker_cleaned_000240_assistant_01_seg_01,عادة المهم الأرقام السودا/الكبيرة اللي تمثل المتر المكعب،,,
bahraini_sft_conversation_gen_cleaned_000217_response_seg_01,وغالبا إذا كسرتها قبل وقتها يقل العائد أو يكون فيه شرط.,,
bahraini_sft_conversation_gen_single_speaker_cleaned_000952_response_seg_01,بس إذا صار عندكم أي فتحة بعد 11 بلغوني، وإذا لا خلاص نعتمد 9.,,
bahraini_sft_conversation_gen_single_speaker_cleaned_001057_response_seg_00,أول شي صوّر مكان الحادث والسيارات من كل الجهات وخذ أرقام اللوحات.,,
bahraini_conversation_multiturn_gen_single_speaker_cleaned_000403_assistant_01_seg_00,سلمها لإدارة المدرسة أو مشرف/ة الباص وخليهم يسجلونها.,,
bahraini_sft_conversation_gen_single_speaker_cleaned_001150_response_seg_02,تقدر تقول لي آخر 3 خانات من الكود ورسالة الخطأ شنو؟,,
bahraini_sft_conversation_gen_single_speaker_cleaned_000723_response_seg_00,يعني موضوعك مو عند خدمة العملاء الحين، منتقل للقسم الفني/الإداري اللي يقرر أو يراجع.,,
bahraini_sft_conversation_gen_cleaned_000255_response_seg_01,جرب تغير DNS بالجهاز إلى 1.1.1.1 أو 8.8.8.8، أو طفي/شغل الراوتر.,,
bahraini_conversation_multiturn_gen_single_speaker_cleaned_000385_assistant_05_seg_01,وإذا صار أي تغيير خبرنا قبلها بوقت.,,
bahraini_sft_conversation_gen_cleaned_000668_response_seg_00,لازم توحدون الرقم: الراتب في التأمينات، وفي العقد، وفي تحويل البنك.,,
bahraini_sft_conversation_gen_cleaned_001025_response_seg_01,تقدر تختار ضمان بالبطاقة أو مبلغ كاش، وآخر شي يرجع لك إذا ما صار استخدام.,,
bahraini_sft_conversation_gen_single_speaker_cleaned_000399_response_seg_01,إذا تقدر تمرّ أيام الأسبوع أحسن من الويكند.,,
bahraini_conversation_multiturn_gen_single_speaker_cleaned_000163_assistant_03_seg_00,تمام، حطي بيانات الشقة الجديدة كاملة، ومعاها إثبات عنوان: فاتورة كهربا باسمج أو عقد إيجار.,,
bahraini_conversation_multiturn_gen_single_speaker_cleaned_000056_assistant_05_seg_00,للأسف الكود شروطه ما يسمح، بس أقدر أشيك لك إذا في كود ثاني يمشي على العروض الحين.,,
bahraini_sft_conversation_gen_cleaned_000894_response_seg_02,تبي نصيحة شلون تكتب الطلب بطريقة مرتبة؟,,
bahraini_sft_conversation_gen_single_speaker_cleaned_000113_response_seg_01,إذا تقول لي العلامة ونوع القطعة وطول/وزن تقريبي، أساعدك تختار أقرب مقاس.,,
bahraini_sft_conversation_gen_single_speaker_cleaned_001014_response_seg_00,اسألهم إذا المواقف free ولا برسوم، وهل هي valet ولا self-parking.,,
bahraini_sft_conversation_gen_single_speaker_cleaned_000357_response_seg_01,إذا الوقت قصير ما أنصح، لأن بتدخل جوازات وتتفتيش مرة ثانية وانت راجع.,,
bahraini_sft_conversation_gen_single_speaker_cleaned_000521_response_seg_00,تابع بعد يومين عمل بإيميل قصير مع نفس العنوان وحط رقم الطلب إذا موجود.,,
bahraini_sft_conversation_gen_cleaned_000357_response_seg_03,لا تحط كل شي بالشحن عشان لو تأخرت الشنطة.,,
bahraini_sft_conversation_gen_single_speaker_cleaned_000256_response_seg_04,"ومع مراعاة عدم تلامس الادوات."" تبين اضيف لج شنو الاطباق اللي عادة يكون فيها خطر؟",,
bahraini_sft_conversation_gen_cleaned_000537_response_seg_01,عطيني شركة الشحن ورقم التتبع، وبقول لك إذا مذكورة عندهم.,,
bahraini_sft_conversation_gen_single_speaker_cleaned_000120_response_seg_01,عطيني رقم التتبع ورقم تلفون التواصل اللي بالطلب،,,
bahraini_conversation_multiturn_gen_single_speaker_cleaned_000032_assistant_01_seg_02,تبين تعرفين شنو اسم الشبكة عندج عشان أوصف لج المكان بالضبط؟,,
bahraini_sft_conversation_gen_single_speaker_cleaned_000899_response_seg_01,إذا في استهلاك غير طبيعي، قدّم بلاغ رسمي عشان يكون في مرجع.,,
bahraini_sft_conversation_gen_single_speaker_cleaned_000883_response_seg_00,شيّك أول شي هل في أجهزة تشتغل تلقائي مثل السخان، الثلاجة، أو مضخة.,,
bahraini_sft_conversation_gen_cleaned_000143_response_seg_02,وبأرسل لك الفاتورة على الإيميل.,,
bahraini_sft_conversation_gen_cleaned_000118_response_seg_00,نقدر نخلي التغليف مرتب ونحط كرت صغير، بس مو تغليف هدايا رسمي.,,
bahraini_conversation_multiturn_gen_single_speaker_cleaned_000141_assistant_03_seg_02,عقبها الجوازات وبعدين الأمن.,,
bahraini_sft_conversation_gen_cleaned_000410_response_seg_01,بس إذا الجرحة قوية أو المقاس واضح غلط،,,
bahraini_sft_conversation_gen_cleaned_000468_response_seg_01,إذا شهادة لجهة معينة مثل بنك/جامعة، اكتب اسم الجهة.,,
bahraini_sft_conversation_gen_single_speaker_cleaned_000361_response_seg_02,تقدر تتأكد من الشركة قبل لا تروح.,,
bahraini_sft_conversation_gen_single_speaker_cleaned_000788_response_seg_05,إذا كل وحدة لها رقم حساب مختلف، تكون منفصلة.,,
bahraini_sft_conversation_gen_cleaned_000920_response_seg_02,تبي تساعدني أرتب لك خطة دفع بسيطة؟,,
bahraini_sft_conversation_gen_cleaned_000010_response_seg_00,حياك، عطيني اسم الطفل وتاريخ الميلاد ورقم تواصل.,,
bahraini_sft_conversation_gen_cleaned_000927_response_seg_02,وإذا تأخر أكثر من يوم تواصل مع الدعم ومعاك رقم العملية.,,
bahraini_conversation_multiturn_gen_single_speaker_cleaned_000101_assistant_03_seg_00,اوكي هذا يعني التاجر طبع البوليصة بس الشحنة بعد ما تسلمت للشحن.,,
bahraini_sft_conversation_gen_single_speaker_cleaned_001256_response_seg_00,أول شي راجع آخر مكانين كنت فيهم واتصل فيهم على طول: كوفي/مكتب/سيارة.,,
bahraini_sft_conversation_gen_cleaned_001324_response_seg_00,إي الأفضل ما ينتشر الرقم.,,
bahraini_sft_conversation_gen_single_speaker_cleaned_000358_response_seg_04,بس أول خطوة البلاغ داخل المطار.,,
bahraini_conversation_multiturn_gen_single_speaker_cleaned_000229_assistant_05_seg_01,وبالفاتورة بعد يكون رقم العداد أو Service/Meter Number.,,
bahraini_sft_conversation_gen_cleaned_001256_response_seg_01,إذا تقول لي أي تخفيض تقصد، أجاوبك بنعم/لا.,,
bahraini_sft_conversation_gen_cleaned_000305_response_seg_00,ممكن بسبب DNS أو وقت/تاريخ الجهاز أو VPN/Proxy.,,
bahraini_conversation_multiturn_gen_single_speaker_cleaned_000042_assistant_01_seg_01,شنو رقم الطلب أو رقم التتبع عشان أشيك آخر تحديث؟,,
bahraini_sft_conversation_gen_single_speaker_cleaned_000665_response_seg_02,شيّك تقرير الدفعات وشهر الاسترجاع عشان تعرف السبب الدقيق.,,
bahraini_sft_conversation_gen_single_speaker_cleaned_000704_response_seg_01,إذا ما يبين، اكتب اسم الخدمة وبقول لك شلون تتأكد من الرسوم وهل فيها إعفاءات.,,
bahraini_sft_conversation_gen_single_speaker_cleaned_000496_response_seg_04,والمرفقات كاملة.,,
bahraini_sft_conversation_gen_cleaned_000084_response_seg_00,آسف والله.,,
bahraini_conversation_multiturn_gen_single_speaker_cleaned_000106_assistant_03_seg_00,UPS عادة يبدأ 1Z ويمشي.,,
bahraini_sft_conversation_gen_single_speaker_cleaned_000096_response_seg_00,اي إذا عندك حساب، تقدر تختار (إعادة الطلب) من سجل الطلبات إذا متاح.,,
bahraini_sft_conversation_gen_single_speaker_cleaned_000530_response_seg_01,'أبي أتأكد من dress code للدوام والاجتماعات/الزيارات.' واكتب إذا في أيام رسمية أو uniform.,,
bahraini_sft_conversation_gen_single_speaker_cleaned_001058_response_seg_00,الشامل غالبًا يغطي تصليح سيارتك وضرر الطرف الثاني حسب الشروط والحدود.,,
bahraini_conversation_multiturn_gen_single_speaker_cleaned_000205_assistant_03_seg_03,تبين تحديث واسم الموظف المسؤول وموعد متوقع للرد.,,
bahraini_sft_conversation_gen_single_speaker_cleaned_000981_response_seg_01,وإذا في أي تغيير ثاني خبروني.,,
bahraini_conversation_multiturn_gen_single_speaker_cleaned_000347_assistant_05_seg_00,بيطلبون إعادة تصوير أو معاينة حضورية.,,
bahraini_conversation_multiturn_gen_single_speaker_cleaned_000348_assistant_05_seg_03,وإذا في شهود أو كاميرا موقع يفيد وايد.,,
bahraini_sft_conversation_gen_cleaned_000193_response_seg_00,إذا التحويل داخلي نفس البنك، نقدر نرفع طلب استرجاع بس يعتمد إذا الطرف الثاني وافق.,,
bahraini_conversation_multiturn_gen_single_speaker_cleaned_000161_assistant_05_seg_01,وإذا الانتظار لليوم الثاني، اسأل عن الإقامة والوجبات حسب policy.,,
bahraini_conversation_multiturn_gen_single_speaker_cleaned_000129_assistant_01_seg_01,شنو مكتوب على الكوبون من تاريخ وانتهاء؟,,
bahraini_sft_conversation_gen_cleaned_000579_response_seg_00,ارفع طلب تعديل بصمة/نسيان بصمة مع وقت دخولك التقريبي، وخله يروح لمديرك للموافقة.,,
bahraini_conversation_multiturn_gen_single_speaker_cleaned_000321_assistant_05,اوكي، عطنا الإيميل وبنرسل الفورم الحين، ويوم توصل بس تستلم الكرت وتطلع على طول.,,
bahraini_sft_conversation_gen_cleaned_000101_response_seg_00,آسف على هالشي.,,
bahraini_sft_conversation_gen_cleaned_000902_response_seg_02,إذا تقولي نوع البيت والمنطقة تقريبا، أوصف لك الأماكن الشائعة هني.,,
bahraini_conversation_multiturn_gen_single_speaker_cleaned_000150_assistant_03_seg_01,عادة أرخص حل توزّع الوزن على شنطة ثانية أو تحط جزء في شنطة اليد إذا مسموح.,,
bahraini_sft_conversation_gen_single_speaker_cleaned_000266_response_seg_01,إذا تقول لي منطقتك والمنصة، اقدر اقترح مطاعم اسعارهم مناسبة.,,
